,reviewId,content,score,sentiment
348,8efa3ee6-aefb-44aa-9b23-7f5c5f1745e7,Love the easy navigation above the data I'm saving,5,positive
349,c17a143d-1b30-4894-8061-0234b81b3b29,There should be an option to disable HOME. 'RELOAD' should be in navigation bar like in stable version. Fix sync issue.,2,negative
350,cb0a4c57-029f-4216-acf1-9c200903b122,Fast and accessible,5,positive
351,7a370b4f-4aca-4914-94f9-ff42110ed3d8,"Fast, accessible and efficient",5,positive
352,f74258b0-1c7a-481f-9dbb-13d581b0e0a3,It gives easy accessible to all site. I love it,5,positive
353,22d501be-09a4-45f0-b3ec-7be7d1fa512e,I think you guys should work more on the navigation,1,positive
354,ebba7cfe-c2ea-4263-8174-aee67e8650c1,"Can't add search engine by long pressing in search field. -------------------------  Navigation history disappears for no reason. While tab's Back button navigation history still has the records of sites visited, I cannot find those records in browser history.  Revisiting same URL overwrites pervious visit records in browser history. In other words, only the last visit to the same URL gets recorded.  I regard all those bugs ""causing data loss"" which is unacceptable.  I stopped trying this app further since then.",1,negative
355,77d42143-0303-4e0e-8092-c625b9b5ddd1,Good accessibility,5,positive
356,822d76b7-7515-42d4-bc9a-fa49283d0f22,"Being vision impaired, this app is helpful",5,positive
357,778bf858-8b9b-48e4-8269-3163074b9056,"The caption is readable size, which is great!",5,positive
358,8399cb71-83c1-489a-83ca-55d150f05f6c,How to disable vibration notification?,1,positive
359,46e9e281-d795-4166-a0e1-bfbe432e2670,"Hey! This is idiotic. Why have you replaced navigation tools like tab, forward with comment section and back button. Rubbish update.",1,negative
360,2a1f0717-ac1b-4daf-a451-dc888fd6a932,It's  accessible,5,negative
361,ad18534e-bc18-41fa-a246-b2c52f2cbbd3,You're my best browser because you're the only browser which has the NEXT PAGE navigation.,5,positive
362,b5b01a56-a0a9-4210-a6a0-57b81ce09f20,"Opera is still the master as far as  smart phones are concern, right from the days of java and symbian phones till the current day of Android, it is the best in terms of speed, accessibility, connectivity, simplicity and data conservation. It his worth to give a trial.",5,positive
363,107aaea9-bc5b-47ee-a996-040d445dfc62,"Eazy navigation,it would be support to torrent sites",3,negative
364,275a031d-20a5-4f39-83eb-bc134b6c9d50,Where's the navigation panel!,2,negative
365,8d92bd89-df00-40d4-9062-78bebb8cb387,It fits for the purpose and navigation is easy plus there are no annoying pop-ups,5,negative
366,d87feecc-d608-4611-8e01-7e6c91d3e952,Great lightweight browser with superspeed and adblock. But lack one thing swipe gesture. Please add gesture swipe for nevigation it would be very useful.,5,positive
367,8726d19a-3c83-4623-9fbb-19004f720388,Good innovation making browsing and navigation more enjoyable and user friendly,5,positive
368,4442dacc-4413-4ce5-8256-d3c6ac87c318,Everyone reviewing rubbish are blind this app is great,5,positive
369,23c19e10-02ae-4d05-82d3-26ff19a7d8e5,Fast n accessible,5,positive
370,6d8217a0-3b7c-44b9-9c23-3b6245f64124,"Accessible, easy & nice.",5,positive
371,0a866c68-516e-483e-a954-0de0ded5a988,Nice gesture!!! :-D,5,positive
372,afa49c74-2180-4f46-b03c-3ad67e7ea1d7,"Lot of bugs, navigation button disappears automatically.Need to reopen. Plz fix asap. Using since days of Nokia java phones.",1,negative
373,866b80f9-aef1-43e6-98d2-5fa1be7924ac,Ngiyay'ncanywa blind!!!,5,positive
374,187ebb8d-a9f4-461e-8ddf-3e6d80e1b774,Been using it since internet was accessible via mobile phones. Never lets down.,4,negative
375,d83eb304-4802-40b2-843d-ae99a959e604,"This opera is better than the opera latest news, because now I can finally get rid of all the news section on the home page. The easy navigation is on par with the opera latest news which I also love, but I think I'll stick with this version instead.",5,positive
376,29002f6c-04a2-4dd7-8627-b5c31eea1dbf,"I've been using the opera mobile app for over 8 years and this is a huge downgrade. Download speed has decreased and when I download files larger than 10mb they keep restarting themselves even when using WiFi and it's a huge waste of time and data bundles. However, it's excellent for browsing and more user friendly. Love the new features. User friendly and very accessible",1,negative
377,3395711d-0124-488d-8f65-4e76d2f163db,"PLEASE fix issue with screen dpi where search box gets covered up during typing. It's fixed in latest beta. Also, FOR THE LOVE OF GOD, HOW MANY OF US WITH AMOLED SCREENS HAVE TO BEG FOR A BLACK BACKGROUND/LIGHT TEXT VERSION, OR AT LEAST AN OPTION FOR IT IN SETTINGS?! (while the ""Night Mode"" might be useful to some, it ISN'T the SAME THING. Making EVERYTHING darker DOESN'T make things easier to read. HIGH CONTRAST using BLACK BACKGROUND with LIGHT TEXT does. Helps battery TOO!",1,negative
378,952c1d3f-754e-4f39-ae80-29245eee6b7e,Its good in speed and accessibility,5,positive
379,71693bf6-04e9-4a86-bf49-8ee67b5c1cf1,Very seamless navigation,5,positive
380,ef07972d-1f18-4cf8-bc22-f6c4978ab83f,Quite accessible and fast,5,positive
381,5ab1448b-d592-477b-bcad-bf26ad71d09d,"Its easy and accessible, love it",5,positive
382,2defd8ad-7976-4cc1-a790-8c59f17ec204,I m happy with opera suprb fastest  speed. No annoying  pop up ads.. Beautiful  new layout with new data saver.. Thanks opera team!! Please add video caption (mp4/mkv)feature while surfing  streaming sites like YouTube etc,4,negative
383,40e64dce-d36e-4bcc-8288-4ba6cc929bd7,I have problem with the text n the arrangement of navigation . It's all jumbled up. It looks awful on fb. My be its a simplified version from the original but still,2,negative
384,5cfa49fd-dc9f-424b-9742-8cc5cab1440d,Its easily accessible,4,negative
385,84553fea-6cfa-4de0-974b-3bf58e00ea7f,"Fast, accessible, reliable. That's operamini for you!!",3,positive
386,83baa210-bbd6-4d55-bcab-0e4a1c75cd4a,I've always use opera mini before and this opera mini that I use now is so simple and has easy navigation plus a save offline that I can view when I'm not online....,5,positive
387,9c0ba16f-ff56-4b30-9684-253085462ed8,It should be easily accessible,5,negative
388,656b622d-1aa3-487f-82d8-6f5c1dcec46e,"stop reseting my pull up gesture, and why is it running in background all the time???",1,positive
389,78903e66-e763-4542-b593-d03a01a6a9c5,It's fast and accessible,4,positive
390,c32f3c1c-576f-46a2-b392-6cf6274f0232,"Faster indeed it is, but navigation takes more time. Otherwise I'll cope with time.",5,negative
391,94eefad7-bcaf-41b9-82b0-7dcacb573d40,Maps and navigation,1,negative
392,570e91fd-412d-4834-9b9d-0ae3d22f209c,"This App is great, easy accessibility and precise",5,positive
393,fac5873e-e9c3-4c4f-a42d-d0e7ae38b3cd,"Amazing app, love the notification and theme and tabs and navigation",5,positive
394,f19e45df-4bed-4218-812e-a300e2ebe415,It's easy to use and it's widgets are accessible,5,positive
395,24989433-dc52-4b8f-a250-cefb3efb0243,Very good for quick views .. and navigation,4,positive
396,74c17481-b788-4265-875f-23e0fdb9e574,Better in navigation,5,negative
397,df24e806-eb62-437c-bf73-af72f1c43763,Amazing app with pretty easy accessibility. Very much user friendly with less memory consumption,5,positive
398,38131590-c1aa-4966-acc7-83a342c25a38,"Features included helps a lot to use the web. I like VPN, data saving, easy to use, predictable navigation to discover all features.  Awesome ""open site"" navigation, ad blocking, bookmark, shortcuts in my home screen, etc.  I don't use offline pages I have unlimited data , notifications (even they are well managed). I would like to have an open feed content instead of the predefined providers even if this is wide.  Great tool.",5,negative
399,e42b5ff5-ce05-4241-8b9d-bf4d392e97b3,I'm with Opera Mini since Java applets. For many years it was perfect example of very well done app. Now I need to take away two stars. Connection speeds through Opera Turbo dropped significally over last year. Also navigation is getting worse. Sometimes page doesn't load after clicking link and it just reloads. Sometimes going back leaves browser in some strange state in between. I use Opera Mini mainly for desktop version of Reddit so just play with this website. Hope this will help you to get things back on track.,3,negative
400,ad70c8ac-96f3-4fcf-b6d9-809638759e38,"From the last update , It is matter of very sorry that the opera mini is not working & can not connect with mobile data. It is only accessible for wifi data.I & some of my friend face same problem.Solve it as soon as possible. Thanks",2,negative
401,feaeb31e-2b42-4657-8396-c63a1a369265,"I like that everything is grouped and easily accessible. Thank you for all the hard work and dedication you put into this, it really shows & makes a difference to the masses that, by the way have no idea what kind of work goes into a n app like this.",3,negative
402,dacd27b2-8ff9-4a0a-9e35-dcd7e285a270,Opera mini is very accessible,5,negative
403,6c9d09f6-f541-4043-9a95-b6b0975367ad,Totally in love with it...its easy and accessible,5,positive
404,6c33351e-7960-44f0-9492-ceb3742eff26,Its simple to use and and very accessible,5,positive
405,6d305110-c29b-4661-b4a3-c13adceb1673,👌👍  I am very like to opera browser. When it's easily accessible to 🔎🌏website and low data used to data saving are more then are save.,5,negative
406,d55eab6e-c64c-4dbb-a29e-a293e7c40485,"Visually clear, ez navigation, handles downloads well. No intrusive ads from opera, no 'surprise ad links like some other major browsers, great aggressive ad blocking. Clean & effective. Thanks!",5,positive
407,55dfd816-6f43-4aba-9f7c-6c44c320e2ed,"The best browser!! Opera Mini given my lg android 4.2.2 new life. This is the only browser that doesn't crash, it block the majority of auto forwarding ads to spam website ie win price by answering questions and fake virus warning with vibration which is a security bug's in java in chrome.",5,negative
408,b833857d-7fb2-45e0-a027-ad11a2b54686,"It's that quick &, easily  accessible ... I' like it",1,positive
409,577b1ca5-607a-4f0b-94b2-ea5927790e05,Could do more than merely accessing the internet. Smooth navigation & informative.,5,positive
410,891561c6-5e3a-4fd7-8f4e-32060e726fd6,"Great except the user interface is getting worst. Firstly the refresh button was removed from the navigation bar forcing you to over reach to refresh a page, just add a refresh button on the bottom nav bar. Now the bookmarks have moved into the menu, more clicks required. Addressing these UI elements will make it great again. I suggest testing using phone one handed.",3,negative
411,02b2b212-1435-431c-b18d-8c30c4352f98,"Best ever but more improvement needed on navigation,update and installation",5,positive
412,7aa390ca-e54a-447e-96fe-24813d0d97a4,Works well but can't find the user agent so stuck in mobile pages. Would be good to have it easily accessible too like in chrome.,4,positive
413,490edf08-b0d8-4b54-b048-5eb96eda5c2b,Lutfor deaf,5,positive
414,1ec13251-83de-4411-a2c4-37f7eb7ee2d9,A great app with quick referesh and easy navigation. Great work..,4,positive
415,d24be670-f48c-426c-bedf-adb7f9ff6a89,"The ad blocker thing, though I haven't quite experienced it, but it's a wonderful gesture, these ads really suck",5,positive
416,f463cdbd-91fc-443c-a845-02be17cdf154,How to get rid of annoying vibration of notifications when they appear on the notification bar?,2,negative
417,9382c82b-c6ff-434d-9dcf-2abea0606ef6,"Très bon navigateur Android. Interface simple, incorpore divers outils facilitant la navigation. Cool!",5,positive
418,c10b0313-327e-41da-b565-5615b34823fa,It is quickly accessible  and can download with ease and fast.  Quality is good,4,positive
419,45ec1fcb-354c-4ad6-8058-f0e3a5658434,Very easy to use and easily accessible,4,positive
420,5f48fafd-bbb1-4c3e-b749-45a7cb48fecd,I blind ding deng,5,positive
421,cb617cd6-17d9-42af-841f-d21274da46fc,Lighting fast. Easy navigation.,5,positive
422,cd134765-5a77-4b21-a6d2-798a2faef44e,Fast n accessible,5,positive
423,fc449622-176a-46af-893f-d1540cfbea32,"Greetings.  Opera Mini browser is the number one browser I cherish the most: It is  fast, manages data well by compressing pages, blocks unwanted ads, etc etc.   However, I'd still like an in-app lock to be built into it. And here is why: I have an applock installed on my phone which locks almost all the applications on my phone.However, once, for instance, opera mini is unlocked, the  BOOKMARKS & SAVED PAGES features are also accessible to anyone.An in-app locker will prevent access to those two features.",5,negative
424,ac0a6e69-6890-4ba3-9979-05d0292f2dcd,"A very nice browsing app. I love the gesture, style and beauty.",3,positive
425,9a85b5bd-820e-4284-a0ca-e12cfd69fa9e,Fast browsing and easy navigation love it,5,positive
426,a62227fb-061c-4c60-9bae-406890633e7f,"doest hang,seamless browsing,simple settings and navigation plus the ad blocker settings..just great!!!",5,positive
427,89e24e8d-61ca-4f9c-9d33-8a7920630b15,"E shapo blind,str88888",5,positive
428,f8122757-d319-4198-b367-f7b81399e188,I love it... Easy accessible,5,positive
429,9d6dadcb-cf72-4cb4-bf4d-9ae2d4353f45,"Best mobile browser in terms of navigation and data saving, totally satisfied with everything it has.",5,positive
430,35d092c2-b6ad-440f-9bea-c32f8559b1c9,Awesome easily accessible,5,positive
431,9171d917-08e1-47ab-9c8c-91228c89acc2,it now very great and accessible after the I update it I love this app it's very great,5,positive
432,c38de9e9-c658-49a9-98be-b9dc9a7b19ba,Speed is not good as per 4G. Downloading is not good in compare of UC browser. News are not so user friendly accessible,2,negative
433,3ba412b8-758f-4cac-92f5-a1ec43aacce5,"Besides the slurry of privacy violations. This app auto updated (should be impossible), stole states of my clipboard, and moved the ""find in page"" feature to be less accessible. This app seemed okay once upon a time, but those 3 things are major.",1,negative
434,ae632455-3f6a-4093-9549-59a1af593be7,"Great  speed.  Easy to use navigation, ad blocker a bonus",5,positive
435,85715666-fb21-4529-a758-a58f16e2bd1e,Accessible!,5,negative
436,c4676bea-3fc1-4c24-8c6e-eb67d3e3037b,"Excellent stuff,current and easily accessible",5,positive
437,93619404-b799-4db6-b039-8bade55c2933,Nice speed n easy accessible,3,positive
438,12cbd26b-f07a-48da-a02a-d72a553317fc,Please make it accessible for TalkBack user and blind,1,positive
439,f8a041e5-3be4-481f-afec-af3596587e58,Its very accessible,5,negative
440,ca6be3bc-dd5d-4c25-877e-9cc55658b7da,Please make ability to off vibration when get notification,2,negative
441,6c55b87d-9966-4e92-87bf-0a92350510d9,"Plz add An Option from where we can block websites...i.e. if we put a website on that option,that website will not be accessible,till then we dont put that website out of that option. Waiting for that update desperately.Thanks",1,negative
442,92447890-9e80-4dc6-acc3-a6bce70a64f7,Good browsing speed and UI. The back and forward buttons are now as they were in the old version; good for easier navigation between pages.,4,negative
443,bad5f11a-86c0-40f9-9716-441e724aa15b,"It's a very good option if you want some ""fresh"" navigation and try something different to Firefox or Chrome i try it and it's very good i really love this app :)",5,positive
444,cfc73cca-af0f-4a52-b0b6-cca64d46d319,Accessible,5,negative
445,476cf81a-81e6-47c8-92c2-375a9d615650,Fast n easly accessible must have app👍😊✌,5,positive
446,36bc572a-e7a5-406e-933f-644f4af9d1cc,"Well in the old opera when u opened a page, and then the mobile data was put off, the content of the opened pages was still accessible when u went back to opera mini. This was 1 of the many features that made opera stand out from the rest. I have been using opera for 4 years now, and was contented, but only now I have started using chrome browser too. The articles with pictures don't align up properly when opened, the sharing buttons of Facebook, Twitter, etc, overshadow the pictures.",2,negative
447,7fd4efd3-46b0-4420-bc70-fdb87b09c47f,I used app so long already but can i ask one thing i dont want my opera get vibration where to go to stop it?,4,positive
448,c899fd06-a157-4557-9a03-1e762a05e6e0,I like the new update and the accessible buttons but ads still come through. Would be nice if there were a 'select this ad' option,3,negative
449,ff336d8e-c50f-48b0-9ee8-d8595938523e,"I enjoy it faster, innovative and accessible unlike other browsers. Wow. I LOVE It. Thanks for this Experience.",5,positive
450,b7314fa2-5a38-4840-b55f-e5f1a58d297d,Horrible experience. Can't display certain webpages and navigation buttons on slide shows. Cannot display certain webpages features as the browser is not compatible with certain websites such as daily mail. The scrolling function does not work for this website.,1,negative
451,acdf29b5-2a65-4a57-8a6a-38c933aed96a,Love the accessibility,5,positive
452,15dc6193-1a63-49ee-8cba-dd0fd2cc1c86,Web navigation more easier,5,positive
453,bea54c27-616a-4d43-991c-f3c260a7071b,"I love its speed, graphics and easy accessibility...",5,positive
454,c62fe416-da42-4b51-a65d-9e06b63b2abc,it very good but it can not be access by google talkback ; i wil appreciate if opera can make it possible,3,negative
455,d0ec5950-7f50-46a1-bd72-1bc8a683f86b,"I've been using this for a while and recently I changed my phone, so I happily downloaded this to continue using. But this version of Opera's default viewsize is like size 5 font, even on the navigation bar. Exactly who can read such tiny fonts? Sure, I could double tap to make it bigger, but why does it load in such tiny fonts?",3,negative
456,4d977f24-942d-4e3f-969d-cc47ca9aba06,"Please add that gesture feature which allows me to swipe down from the URL bar to change tabs like it is in Chrome. This is extremely useful on larger phones, so we don't have to reach that one button. Otherwise it'll be 5 stars for me. Thank you :)",4,positive
457,27fa43c8-6013-4c04-a78f-c1e5058c86b4,"It saves data, easy and accessible",4,positive
458,69448c57-28f5-40aa-8f37-7f786f5bdaad,This browser is smoothly accessible to me!!!!,4,negative
459,2ea06379-ed4a-43f8-8fb1-24df0998bb88,"This app would be perfect if it does not come with Swipe Gesture on home button. I have an Xperia smartphone. Before installing Mozilla, there is no such gesture. But after installing, it appears. What makes it more frustrating is that there is no option on Mozilla settings to turn it off. Aside from that, Mozilla is a solid browser with its design and extension support. Worth installing.",3,negative
460,258b6d70-4a80-49a0-b487-2ee06e6e63d4,"Blind people can't use it. PleAse, improve this app so that blind people can use it.",1,positive
461,892d1546-f620-4754-b022-c3a88190bbad,It makes every accessible faster,5,positive
462,e1d8c3be-79b3-4d55-8ba3-5ddada396dda,"Pathetic browser. I tried to access Bookmyshow site and searched for ""sufi"" program scheduled this weekend but it does not let me search that in website. The search magnifier goes away however in Chrome, it appears fine and let me search. The same pathetic response by UC browser too. Chrome worked perfectly fine. There are problem with the website layout functioning too with Opera.",1,negative
463,eb5cef67-3fb5-4316-b4c9-0a4d79c19f56,Its awsome and ease in accessibility,5,positive
464,bd48df96-869f-482b-80e6-5d732b1a29fb,"Love it so much! Humans are naturally against change but this is one even a blind man would rejoice at. High level creativity at work here guys, please keep it up. I'm stuck!",5,positive
465,39458973-e42e-4367-a6ac-6c76fdc1164b,Quickly accessible,4,negative
466,b6c0c80b-c828-4eab-9e22-52a7778de042,Very good n fast accessible,5,positive
467,14df8c61-a873-4f84-9a1f-ecbde0d66224,"I'm visually impaired and require three things. 1) ability to increase text size. 2) auto text wrap to screen so no matter how big my text is, it fits the width of the screen. 3) no adverts. Adverts in the middle of text you are reading is confusing. OPERA MINI doesn't allow me to auto text wrap to the screen of my phone when text is big. It cuts out adverts yes, but I'm having to move from side to side when I've increased text size. Please resolve this. Thanks.",3,negative
468,181643f8-3ed3-4c2b-8c19-8412284cfe4a,It's fast and easy accessible,5,positive
469,1e133b44-1954-4fed-af68-17885bbd5fc8,"Very light to use , very smooth, though some features of webpages are still not accessible",5,positive
470,ce412069-9117-4274-a18d-6132fc886745,The new opera version is just awesome. It has a great speed accessibility and feels great with that data saving feature. Hence overall assessment is that the best app till now. Good luck opera team and hope you would keep working the same way.,5,positive
471,e6bc71f2-ff18-4abe-881f-51481ad27a01,Very good and easy accessibility,4,positive
472,ced475c2-dc09-4fd3-afae-8f4749542a53,Good speed n accessibility,5,positive
473,babc13f5-2eb6-4c84-a003-85b0f568943e,Best in accessibility,5,positive
474,d21f03e8-cc6d-478b-8939-6aa9b025cf1a,"A very easy to use browser, quick to load and fast navigation.",5,positive
475,dd0ffa72-21bb-4492-af8f-0e4ebf560765,"Not just the speed, the overall experience - including the UI, the easily accessible features, management tools..",5,positive
476,18252504-8ae1-4a6c-bf8f-c0059bb017fa,Its fast and easy accessible,5,positive
477,a924fae5-67c6-41f0-87f0-f3ced3105281,I loved to use it the only one solution for browsing sites which is not accessible from other browsers.....,5,negative
478,05fce903-4808-4386-aeff-2417c774d592,"Two things I need and it delivers. 1st is text reflow. 2nd is larger text. Also, you need to increase text in android via settings then accessibility  increase font there too. If there is a paid version gladly pay for it!",5,negative
479,dc7ab5b0-7184-49d6-b4e2-f923e7f9be02,"It is easily accessible and it does save time, also does not consume much data",5,negative
480,49e4216f-4221-40d6-9452-e975900ca67c,I have always loved opera mini it's the best and most easily accessible,5,positive
481,59223a3b-0cc1-4086-9cd6-39a0b9cd2d2d,👍 Browser themes 👍 Ad blocker counter 👍 Extreme mode media player 👍 New data-savings view design 👍 New navigation bar icons 👍 Default browser option,5,negative
482,a818c62f-4eef-4383-93a0-e07c77b78fc8,Fast and easily accessible,5,positive
483,268ca211-56cf-4211-ad4f-c30a96ba7c46,no Browser themes no Ad blocker counter no  Extreme mode media player no New data-savings view design.. - New navigation bar icons - Default browser option...wot is the reason?,3,negative
484,6cbcfeab-8bf2-4fcc-aac5-f2348efdf33e,"ad block - 5 star , speed - 5 star , notification about data - 5 star friendly features - 5 star , navigation - 5 stat.over all 5 star., just one quick question.some of the video sites not working,for example no video clip found in the website.well theres only few..more important is i try to switch to other browser but still it leads me back to opera..kudos to the team who's in charge of opera mini.",5,negative
485,6a2622f8-206a-4c7d-ae69-bcb1825c084e,"I've been using this software even before android - good old symbian days. Great app for reducing mobile data bandwidth. Also useful when web pages are not directly accessible, as it composes the pages through its own connection.",5,positive
486,1ccd3e80-3829-418b-aef1-32726be4c08b,Forums navigation fix,4,negative
487,3bb0ca36-4a8d-441c-ac95-2244c1a8699b,The app is compact with many pages accessible at a go. Very easy to use. I like it.,5,positive
488,bc9eda37-8ead-4e59-adc6-5c50ce5a959e,"Its supper cool and another good news is this one, does not stop on navigation.",5,positive
489,60cc68c1-0b7a-4ef0-ab58-952aa9dc48ed,Easy to use... Even the blind can use it. 😀,5,positive
490,29511962-74e2-443b-92b7-396bdb487484,Like the navigation buttons at the bottom of screen within thumbs reach.,5,positive
491,9b9fc9f2-dd07-4c1a-8722-8d65cc18f428,Simple to use and saves data.Great and an smooth navigation,5,positive
492,920a5b64-af41-47f6-9697-ed08941c4ecf,Fast and good navigation,1,positive
493,63b84ba2-7fdf-4527-a953-e064020bbfca,Accessible,5,negative
494,0c1ef3cb-2992-4081-a39f-a920b69d1475,Day by day improvement in app. Rich and smooth navigation experience. Really love it. Adblock can be improved.,5,positive
495,7e74339b-c777-4fcb-94b7-5eeca7084288,Very smart n easy accessible to the internet its fastness is explicitly gargantuan,5,positive
496,4dacdb22-7cd3-4292-806c-3fb5ebe6f6da,Adblock works perfectly. Disable extreme mode for better navigation and rendering of pages. This browser allows downloads directly to sd card which is good,5,positive
497,33dda7f5-758f-48c7-872b-c62f2149d67a,Ease of accessibility n fast,5,positive
498,13bc1f4d-dfe6-4285-b833-809e119a47f0,The speed is good and I am loving the navigation of sites.,5,positive
499,5060a377-ad98-4276-8161-e56debeef80e,Your app is great but I want youtube to be accessible also.,5,positive
500,2fcbfd2c-6381-466d-b2a5-2890fc47d427,"Truly fast and safe browsing , nice navigation great job i love it😊💜",5,positive
501,b6a7d9e4-2c13-4b04-afb2-969e6b31ac69,After the latest update the navigation bar sticks...and sometimes doesnt work,4,negative
502,cc6c2922-9b07-42eb-a963-bf6ac005ad23,Every browser out there has so many useful functions in built. This one doesn't even have incognito mode easily accessible.,2,positive
503,b38d2de6-a49d-428d-b5cf-73b96841cf0b,Nice app easily accessible,5,positive
504,7f67712c-18aa-4d33-84f2-1653dd46c3ab,Inclusive nd cool,5,positive
505,feb4d0ae-14e7-4bcb-a140-23fb7073e215,So far so good but i have only used it for about an hour or two.Still figuring everything out but it seems pretty easy and accessible in its layout and settings.,5,positive
506,629403cd-a951-44e4-9d78-444ce0914e4c,Superfast navigation of the net.,5,negative
