,reviewId,content,score,sentiment
184,e1f51180-0558-4e76-a353-9efcc9dfb1da,please improve your rendering engine to make operameenee axessible for blind people and thanks,3,negative
185,ea0c347c-d1dd-4d99-950a-5f8101aa7ac3,very fast navigation !,5,positive
186,1858d56f-ec62-4d0f-a7cc-c2f4933a1e6d,Awesome app to have on your phone speed and accessibility is its duty very awesome it deals with everything in a good way especially when you want to access to anything I really think this is one of the best apps to have on your phone it gives you what you want as long as you are heading to a good direction one of my best apps on my phone,4,positive
187,36973082-f33a-4e01-9b40-10cbd2f50d8c,This app is great. Fast and easily accessible.,5,positive
188,b6973428-29da-46dd-b86b-5fc140491035,"nice ui,easy to use navigation,download speed bravo,but drag much,isn't this suppose to be a lite version?too drag for a low range device",3,positive
189,37eae857-77ab-4524-909b-bbe36e4c7968,"Feels a little more stable and less laggy than the beta version. Unfortunately I have to wonder why the devs removed the back/forward navigation buttons in tablet mode. Other than that, it's pretty streamlined and convenient, but man being unable to quickly go back to a previous page is a huge downside. It would also benefit from a ""true"" dark theme like the full versions. I do love how it can easily sync to my other devices, including open tabs!",4,positive
190,482f2287-4ff5-4bcf-9a59-e236711546d4,no caption,2,negative
191,9036042b-aa1f-49b4-b371-f65062a813ed,very fast in accessible,4,positive
192,1259125b-ce6b-4da5-9cb5-f34379161db9,"I enjoy making use of the app because of its easy UI and design, accessibility is also good but i recommend a fix on the download part, thumbs up.",5,positive
193,bd8e8f7a-8113-46a9-9c5c-258ab88cfaed,i am blind persons. I am going to uninstall the app is very very bad. their is no way to use it for the blind people.,2,negative
194,b50eefd3-5994-4273-8c46-490d50e59bde,It good and accessible,5,positive
195,b6227f7c-ac48-4e74-b82f-44a1f68a4c9f,Dont like it. Ads are intrusive and slowing down navigation. Dont recommend it,2,negative
196,578137b8-cc39-4ca4-8b3d-5dc7b65913c7,its wonderful and accessible,4,positive
197,249eba06-0f61-4bc5-a0f4-ee7de1fab3fb,this APP is not accessible and friendly to persons with visual impairment why? it does not support google talkback.,3,negative
198,4a940e75-1bfb-4291-8dc1-050631b4d163,"very good ,fast abd the safest app for navigation,kudos",5,positive
199,d589860c-20d8-4e2a-8102-68e5086b7971,fine en fan easily accessible and most appropriate for the time we use,5,positive
200,d06448f8-df60-4b02-b33b-20d2b8ed1bc5,Nice app.... Support blocked site accessible,5,positive
201,10ed51d3-7b56-417a-809f-dcd632aa4722,Nice navigation app.....love its simplicity nd still remain my best mobile browser.,5,positive
202,a6aa93cb-eae3-425a-a025-a23ba2f6bf49,efficiency and accessibility,5,positive
203,ee8a6b08-3646-4763-8521-ca2797fa3a1c,it is easily accessible and fast to browers something in!,3,negative
204,69c90216-5c8d-4f54-bf8a-032df8cca03a,very frienly to use and lets you easy navigation.,5,positive
205,c9bb999c-0942-499d-8f0c-a75854b887fa,blind review i m going to give its looking an amazing app may be well try it no cast on trying thanks,5,positive
206,eeb09e5a-d766-4392-8ea6-3f8c1aeadc69,Still searching for downloads navigation,4,positive
207,985070f6-5ebc-4899-ad4c-a85e5d459f98,"Whenever i open my opera browser and browse a few pages, it's like the entire opera homescreen freezes. the navigation keys works but i cannot open another site from the speed dial, they no longer respond and it's terrible. please fix this! the previous version is better",1,negative
208,4407704c-9fd6-43a7-874a-ea0c8dbad41c,"Ads pop up between search result selection and navigation to site. Many websites don't work. However, it is very small and fast.",3,negative
209,ae89a48f-adda-40af-bdb9-152a135ed349,Need more accessibility and news update need betterment,3,negative
210,fc16e614-670a-4858-afd9-324355518494,"Loads faster, blocks a significant number of ads though it would be better if the app had a navigation button for back and forward to navigate through the web pages.",5,negative
211,32d3435c-cdd3-4b98-831e-0646f6a6daca,blind blind,5,positive
212,68c5b755-3b29-4aab-a83a-68c2f18b5cfb,Accessible,5,negative
213,456c6965-5a5c-45b2-84ae-b3e2f603f652,Make internet to be more accessible,5,negative
214,824a61cd-c601-493f-ba5a-8cb0d58fe72a,It is easily accessible congrats,5,positive
215,b16efc43-e486-4cea-9014-2f25f4bd02b3,Great and easy accessibility,5,positive
216,37c74e84-0fa5-4a73-8970-ef8d16c32a71,I'm deaf,5,positive
217,5140ee59-e74e-44dd-a576-d03c83ff7665,It is accessible,5,negative
218,ae4c5ccb-7b5f-4b1b-adba-7b4bb5213bbc,I think it is the best app and is accessible,5,positive
219,e68d0e32-0cad-4b81-88f9-2721c4463fcf,I think it is the best android browser around after using many others over the years. It best features are it massive data saving and simple navigation. But you need to correct it pages crashing sometimes,4,positive
220,c6d696e9-ae59-4285-8abe-2a000684d3b5,Improve on accessibility of functions,3,positive
221,e08a5cde-6b97-4388-9383-288998abb493,It's easily accessible,5,positive
222,c2fb63f5-71f4-4136-8378-45068c1d102c,De loin la meilleure application de navigation testée (et j'en ai testé plus d'une),5,negative
223,7e65d4b6-0729-43e0-a854-6dfb4b5038ba,Opera team please fix facebook notification sound & vibration issue. No facebook notification sound & vibration playing.,1,negative
224,016ffa5a-3ef4-4db2-88bc-01eb9e503c02,There are no accessible bookmarks. It is essential for me. But.,1,negative
225,47504bd6-be69-4c87-bce7-2dabbd61a104,This app has very accessible approach.,5,positive
226,94a5b1a9-db23-4512-82f8-db1d07117a4c,Make its interface more easy and accessible to all types of downloading sites.,4,negative
227,acbaf124-043d-4014-9c1f-38f8a36ceeb2,Easily accessible and user-friendly app,5,positive
228,f5252591-f3f2-46e2-88f9-9fcffc904787,"I blind lwau tamba lini, mudifho",5,positive
229,7bcf3c31-d58b-495b-becb-9995921f9964,Its one of the best app so far on terms of accessibility and speed,5,positive
230,9c8cad02-c975-4478-b486-c1b036121545,Good app. But work on navigation.,4,negative
231,deff9770-2fb3-4ee2-91cf-ebc58218a9a7,Great navigation,5,positive
232,aa785466-acc8-4824-8e94-8c717736ae59,"This app is insanely amazing, it's so accessible and easy to use.",5,positive
233,dd0e0bdf-f58b-4e77-961b-1cffd41dc474,Accessible.,5,negative
234,e47615d6-5fd4-423d-a693-9f16e68faf20,"I like the fact that things are being simplified and easily accessible 
which is basically what most people look or go for in 3rd party 
browsers....i myself i will say i love this app...thumbs up keep up the 
good work though. But do have one issue and that is occassional crashes so 
fix that and you will have everyones 5stars so to speak",5,negative
235,1ac9bf87-a31e-47c6-b4d8-6a6cc2f5a877,It's good browser and easily accessible,5,negative
236,ab660174-11fc-48ca-a152-4a0f3fa6a147,Super and fast in navigation and downloading,5,positive
237,71dd1f75-d3d8-4c8a-8af8-56e2c779e4d8,This a such fast and accessible app.,5,positive
238,c6a12b72-b22c-480c-84f7-f3c515dc5a9d,"Very fast and lightweight, but exactly with enough features for a smooth 
navigation. Great app!",5,positive
239,dc8209aa-4f0f-4474-b506-52f59dff0115,How can I off the notification vibration? It's too annoying,2,negative
240,f0704203-8712-4dcb-b246-cb8a512ac515,"When scrolling down a page, both navigation and toolbar disappear. That's 
good, but then, to make them visible again you need to scroll back to the 
top of the page. As a user, I believe there should be a better and more 
intuitive way to have both bars back on the screen while still navigating. 
Maybe a quick click in the page, or a swipe-up from the bottom of the app, 
or anything. Please, fix this.",3,negative
241,85da92fa-48d2-42d5-9ff4-af941e8e3d5f,It a good app...very accessible,4,positive
242,dce3eb1f-6e7a-4daf-8cd1-d37acd0a657c,"Fairly good. It blocks ads, lets me play flight rising and check tumblr, works about as well as chrome. Its not as smooth or fast, but it's much safer, and the data saving is god level 👌  My only problem is that occasionally it fails to load hyperlinked images, and a few other graphical bugs such as the url bar being replaced by an unmoving strip of white occur sometimes, but it's bearable I guess.  A suggestion I've got is to implement something where if you tap a link without zooming in, it comes up with a little magnifier and you can make sure you're clicking the right link. That and fixing the hyperlinked images would make this a 5 star rating.",3,negative
243,0a49e888-9892-498f-a811-ccf9d458d6c0,I think this app is really cool. Very accessible and dependable.,5,positive
244,ccb90b05-eb64-4673-9806-796fd02c9142,It's accessibility it awesome,5,positive
245,a967f58c-1f02-4071-b64c-f24e8d24da8d,Easy to use.. And accessible,5,positive
246,63063580-6171-454b-b65f-833d909a22cb,Used to be an Excellent browser but the acquisition by Chinese killed it for me. Now I'm scared of using it. Not to mention they've made hindi as the default language with no visible or easily accessible option to change it.,1,negative
247,5ad4df3c-9d83-4aaf-995d-593cf0405ac1,Its a great app that give you good Quality accessible websites it's awesome,5,positive
248,6b6c70b1-aee8-4550-9bf6-d75b099d83d1,I've always loved opera mini for lightweight use but it's annoying having to scroll back to the very top before you can access the navigation bar at the top.,4,positive
249,2d0a1e0a-e3dc-473c-a76f-4481ad4b2e9b,I did not appreciate their lopsided liberal agenda news reporting that echoed the emphasis on presidential bashing and paid little attention to accurately reporting news. The contrast of reporting from Obama to Trump is unbelievable. This browser seems to shove their version of news in your face. I'm uninstalling.,1,negative
250,f608f773-281a-4331-82c6-ffab1afab538,It's easier for me to use. Easy navigation.,4,positive
251,ecbf95bd-d440-4386-b953-aaf82466c41c,"Where are the accessibility option s apart from night mode? I can't find a way to increase font size, can you please produce this (again)? It would also be great if you'd enable reflow of text when magnifying - an earlier version had this. Thanks  Edit: no worries, I just downloaded the Samsung browser, they offer all this that Opera doesn't.",2,negative
252,6a0b6f62-3b87-4a97-a824-d7dadcc277fb,"Better before the update, unnecessary app navigation when you want to read more. Latest update it's a floop.",1,negative
253,939d61f3-3ad7-447f-aa46-5c6ada431a39,Improve on its accessibility of different websites,4,negative
254,7b17fd04-321d-4c43-bc1a-c0f55dcbbe2e,You are the best in internet navigation help,5,positive
255,9b73657c-9318-437e-9f09-bb32d22e8573,Easy navigation,5,positive
256,71178fd8-dcf7-494d-9d1a-7422819e7561,Accessible,5,negative
257,ef2dfec9-b45c-4311-b196-52bbe8276e14,Accessible...very easy to use,5,positive
258,f9c6c35f-3a79-4c87-8df9-de7724810248,No gesture controal,2,negative
259,770cd1d0-e869-4b52-8540-56ecfe4f515f,"Slow, ads on homepage are gross. Celeb or click-bait. Too slow/unresponsive to bother with. Back in search for a good browser, pref one without plastic surgery hags on my home page. Navigation not bad.",2,negative
260,3a66a9ea-b15c-49c2-a7d3-633328acb806,It's lit and the high speed is super I just love the presentationand accessibility,5,positive
261,2911996d-6507-4960-bc7e-a4e60e661e88,"Too much of ads getting heavier day by day, annoying popups, no option to remove vibration.. losing its name and credit! Sorry won't recommend!! Tnx",1,negative
262,2b301af7-1576-4d22-9944-b528df2b952e,People who dont like it are foolish n blind,5,negative
263,fffa7da7-e2b8-41dc-87d4-1eacc9a9e181,"It was a good browser. My #1 indeed. But nowadays I hate it coz of (1) pop up ads, despite the ad blockers (2) pages reloading every time you close and reopen the app. (3) inability to optimally load all the features of a website, even if data saving is disabled (4) pages refusing to load requiring data saving to be disabled (5) No back navigation if the layout is set as ""Tablet"" instead of ""phone"" (6) ads, Ads, adS, aDs, ADS",1,negative
264,442c19ab-beed-4b84-9da0-601a3cc8e703,App was cool until recently when accessing .co.ke domains became next to impossible. Please fix this issue because those sites are accessible from other browsers,3,negative
265,6a6bd0c5-2f7e-444c-87ab-5faf2f7e6568,The app is convenient and makes accessibility fast and easy,5,positive
266,00174caf-6f6c-4866-9ac4-ae269bd84220,Accessibility made simple. Big up!!!,5,positive
267,03a1c369-26ba-4039-aff2-4cadf660a8fe,Gesture  problem,1,positive
268,64b1dfd1-0e65-4d87-a298-a5b7b64924cc,I wish there is a high contrast mode or night mode with dark/black background. I've used this app for years already and its a great app.,4,positive
269,d4592f16-eb31-4937-bd68-2e57bb8c8c16,Ter previous update it's Running very Worse. Just stop few times in Hour. Can't load Sites  anymore with ease. Sometimes exists without prompt for force close. It's Freezes while navigation. Just revert it back to stable version,3,negative
270,5e3a936e-96f1-4fd3-90b4-8954b526eb7e,Nice and accessible,5,positive
271,10753b1c-6f66-45db-b26b-4e9a44ffb1c5,Great accessibility and easy to use .,5,positive
272,0da836bc-01a0-4c56-b6c9-9d63236b66f5,Fast and accessible. I love it,5,positive
273,b1d09159-9185-4b12-a7a7-3f71c963d142,"Got a pop up with news while I was riding with navigation on. Had to halt, take out my gloves and click cancel.. uninstalled right away.. You are a browser, act like one..",1,negative
274,e7ddf324-82d0-4489-af0b-6a458efdb305,I think I speak for most people went I say it's easily accessible 😀,4,negative
275,0da87e43-fcdb-4fac-b27b-0da3f1887c6a,"I always believe smart means easily accessible, that's Opera Mini",5,positive
276,8522c84b-39df-475c-9c35-f1e54e2740fe,Its the best app of mobile navigation!!,5,positive
277,0617a542-9465-4bd3-bebc-730a4752acac,Keeps sending me notifications (with vibration) about politics even though I set all news and notifications off. And now ads before loading the website. Deleted,1,negative
278,15ec41ad-757e-40ad-8699-7defec4f0ada,"Gostei do Opera, mas ele demora muito pra voltar e abrir páginas... Já fiz o teste em outros navegadores, inclusive o Chrome, e constatei que é problema no app mesmo... Fora isso é excelente... Gostaria de elogiar o bloqueador de anúncios que por sinal é eficaz e parece que é o único navegador útil que traz esse recurso embarcado, parabéns!",5,negative
279,031c1cb0-bf13-46c7-9d23-bef0559fa1f5,"Just been using it for a couple of days now, and that is how it is working here with all the neighborhood trying to make sure that you are going to get blind by using this app. The Indian citizens of the state of Goa, 403507, India 🇮🇳 are ALWAYS IRRITATING YOUR EYE'S ON PURPOSE WITH THEIR OWN HORNS, NO BULTACO OR MAICO MOTORCYCLES, OLE, OLE, JUST MICO BOSCH PUMPS BEING USED IN THE ENGINEERING OF THE DIESEL ENGINES MANUFACTURERS COMPANIES TRYING TO GET AWAY WITH MURDER MURRAY.",4,positive
280,e50cb6a9-50d8-45f0-b58b-af37d6c0ed53,"Ads too much as it hardly do anything without seeing one, even before opening the app.. New appear on the notification bar, old page now load instead of automatically scrolling back, forcefully download of app right below the navigation menu, plead you guys should make amend or would gladly delete",1,negative
281,157f4c3c-645d-4d4d-b1a8-3553ed08ec1d,"Navigation in v31 is not good, rolled back to v30",4,negative
282,dba99336-31f6-4664-9ff5-15a2fd75d40d,"You guys used to be the best browser and I've been loyal to you since childhood but it's a pity you've lost the throne due to your greediness. You now force people to update to the latest version by disturbing us with ads when you are supposed to protect us from ads and even when we upgrade to the latest browser thinking we will be free from your regular ad promotion, things got worse... It seems the only thing you care about now is to make money and not to satisfy your dedicated and future faithful clients. Everyone keeps complaining about your latest version and yet you turned deaf ears.. I'm removing your stupid browser...",1,negative
283,e0947018-911e-405d-b8d0-76a41310712e,E lebelo blind...,5,positive
284,6b37325f-90f7-4a54-8874-82dbb28994a3,Cool and accessible,5,positive
285,a7beda55-f6b5-4e97-905f-fa9209b4c699,Not bad....   Gesture options unte inka bagundedhi,5,negative
286,105f7228-b6a0-4de4-bde4-5e2ffdf606e7,Its accessible and fast search engine. ☺☺the best,5,positive
287,ac9b2a66-5d4c-4af2-91a7-4403721214db,"Love it for it's easy navigation let me just say ""simplicity meet class ""...thanks opera",5,positive
288,ad648828-b720-4a78-984c-300ac859eefb,It displays news in my notification bar with vibration which I can't change in my settings,1,negative
289,3bbd1110-5a7c-43ce-9826-42ec3afc773f,"Used to be my favorite browser. But ever since the last update the navigation is no more smooth, especially while zoomed in. It has become too jarring. I wish I had not updated.",3,positive
290,651a0454-0dc9-481f-b090-5da792202a66,"Its easy to use,& accessible easily than other browsers.",5,positive
291,3f64d484-a88a-4ba6-ae46-21276dc9f14a,Very nice browser. It also make us aware the ongoing news and happenings. Ad disability feature is also nice,5,positive
292,9e1a0a4a-8f31-4bf7-a86c-b5f6be9bcda1,Jb bhi opera browser on kro to vibration start ho jati hai....,3,positive
293,a785e405-7cf4-47dc-8439-2d3f9dcdac05,It should to accessible to every site and can be used for downloads.,5,positive
294,6e4c4c61-585e-4937-9514-c0966e32474f,Positive vibration,5,positive
295,7911eee0-5a2f-4c49-ab3e-fa1dbe06c808,Some sites can access to phone vibrations and i personally think that they can access our data through this browser if they can control vibration,1,negative
296,80befd12-2aa4-4ae9-b2ef-a5ff8a00a25a,"I would love to rate it 10 stars 😁, if they could add a read it self feature for some reading article since sometimes or most of the time my hands are full.. Please.. I've been using this app for 5 years now.. Please make it happen. Its kinda helpful for my aunt who's blind for her to listen in some article",5,positive
297,92bdffad-a285-4397-b1c3-51090f500eae,This is one of the best browser all features are accessible,5,positive
298,5e93e6d6-3608-413b-a5b2-19ad4b652e6b,Please add gesture support for youtube videos and remove vulgar content from news feed Thanx,5,negative
299,cde66024-b551-427f-904d-adb47f7cf746,New version not saving data only 2 or 3 time search it using lots of mb like ucbrowser and  suddenly it's start vibration without any notification and contnously do for 6 Sec,1,negative
300,1ee08b0c-2c95-4599-92da-fc7acaf42f9f,"I don't ordinarily leave reviews, but I am doing this with the intention that you guys will see it and improve. I have always used Opera mini for years, right from the days when Java phones rained. I carried this love to Blackberry, and now to Android. All these while Opera mini has served me well and made my access to the Web very suiting. Unfortunately, these days the company has been doing things in contrast to the way it does things before. This app is being moulded into a standard browser like Chrome, Firefox, etc. Although, this will be considered improvement by some people, but honestly it's not. People who have been using Opera mini for years will understand this. The plain 'Opera' is the variant for people who want a standard Web browser, while the mini Opera, 'Opera mini' is for people who do not need anything other than the information on a website. My 'Opera mini' is now almost the same as the standard 'Opera' I have on my phone. It's now sluggish, it has a longer response time, at times my phone heats up when I open too many tabs. Can't we just make the mini stick, let's stick to mini. We already have the standard Opera, then why make mini as well standard?",2,negative
301,c64bd9a8-087a-4b90-a25c-934ab22e4581,It gives an unexpected and useless vibration whenever i open the browser,1,negative
302,c2e0db42-f0b3-46f3-9643-912dc0d55269,pls add accessibility features,3,positive
303,d9761a20-6a9b-4259-8e8f-96cae022b9ba,Kept vibrating the phone very often for no apparent reason... uninstalled it as there was no way to turnoff the vibration,1,negative
304,e6227cb3-d8c4-48af-874d-be0dc9a0004e,Very modern and fast. Improve navigation and save data files. I really like it so yo will.,5,positive
305,30561533-996e-4d8f-b65d-5dc38ea4a6c0,"Easily accessible,",4,negative
306,7c3cc7e6-7189-4b48-8690-a762fe24c013,Open hiretho difficult slow websites quite easily & flexible fast navigation of tabs!,5,negative
307,7f1b6c5e-d43f-4484-986f-11d79f346280,Accessible  Easily,5,negative
308,6fd8be89-b288-4dd3-ba9a-7981862d67a7,Very nice and easy navigation,5,positive
309,d987bdda-067a-4299-8d19-5e5af5c83647,Accessible,5,negative
310,084279ae-431e-4561-af82-84f3c98d8142,Blind,3,positive
311,e0cfeb0c-7f2d-4e72-b48d-9d19a2088730,"For data saving purpose, can you make the option to disable images just like the version on windows phone? Also it'd be awesome if you have a high contrast theme with black background and white texts to save battery too. I've been a fan of opera mini since symbian os and i'd love to see these old features on a smartphone again.",5,positive
312,6aa20c5f-421e-46cf-8261-98eeccfd2465,Good App easy & accessible,5,positive
313,ee4ee34c-d418-4673-b249-2b5666084f1e,"It's really easy, accessible and good",5,positive
314,7e2230d1-02d5-48cc-b631-e0bd09f7ae83,It's amazing and accessible I love it,5,positive
315,5cb7e78b-ec0d-465f-b78c-fa361cfbc736,Y it is not loading any of the site I'm going to browse gmail  it is saying tht not accessible in uae,1,negative
316,ea1d400d-a9fb-4e31-8bf4-7d653f0a5ced,Plz add tab switching gesture,5,negative
317,f9a4a5cd-d481-4c43-902a-8269a3206a30,Great speed and accessibility with less data charges.,5,positive
318,3219b448-9903-4377-93e2-ed0dbd6956d9,"Not installing make error unknown error code during application install:""-24""      problem making when I searching on Google from opera mini fore some things because  YouTube  is block in our country when I searching on Google it shows me the problem,,,,,,,,,,,,,  Surf Safely! This website is not accessible The site you are trying to access contains content that is prohibited for viewership from within Pakistan.",5,negative
319,607e0b45-4ff1-4b31-8cc1-29a1a4273021,Easy user interface and navigation coupled with amazing internet speed....Loved it.,5,positive
320,8a9ba157-b860-4f2a-811f-0bbedc878bde,Convinient and accessible,5,negative
321,322c3870-eeef-4fe8-b083-ef531dd14d80,Easy and accessible,5,positive
322,d7a8b53a-e3a8-4757-9ff4-9eb0711f7062,Very accessible.,5,positive
323,91629c51-30bd-4f2e-9bb0-91c691c7290c,Is Ok and accessible,5,negative
324,de891fe6-e36b-403d-82e9-62d3738c431b,Good work....it's perfect & easily accessible!,5,positive
325,f1250480-d603-4d28-9965-33d7c13f2ac2,Opera navigation pane and scrolls seem exquisite,5,positive
326,e3dfea24-7379-4f2d-bf96-2efd5785c8ee,"Greatest,,easiest,,but the youtube have no navigation bar",5,positive
327,48e78abb-2750-4050-9434-f8866909344e,Secure and fast accessible,3,positive
328,9c65ad91-22da-4438-bd92-36dbe9f2aa1d,Great app to use easy accessibility and most greatest saves data    😄😊😊😊,4,positive
329,47b6a38c-a258-41c6-8f0f-bacf29ece1f1,Romove news feeds..  or change a separate navigation,4,negative
330,57e229e7-d4e8-44ed-b0bc-1821d5ee7e17,Accessible,5,negative
331,cfaf9032-7cb3-43ec-8398-9289b79cbd09,"Best browser on Android. Has great navigation tools and interface (buttons at bottom of screen). Data saving mode is great, fast and blocks ads.",5,positive
332,63635a80-9054-4ab1-af11-a297d6f80aee,Not able to upload photos and google forms not accessible,1,negative
333,86008749-3bc6-4e6c-8efb-6d27abc85ed7,Open my Truest Mind to Truth and wonders we have in life to offer and help me enjoy it to the fullest by living with it.Giving what is Rightfully yours and not being blind to it.Let more truth and answers to all burden of earth life be opened and answered with solutions beyond expectations made easy.,5,positive
334,d91dd137-98e8-4e6c-b520-359517fcabff,To to have navigation,5,negative
335,55cb1870-7faa-445b-9877-5b4302a6b0f2,Not accessible for talkback users,1,negative
336,79bd394d-0b8c-420d-80ea-7ac0ece2d5ea,Easily accessible and great to use. Very fast as well.,5,positive
337,948e2d6b-175b-4d97-9bc6-c9f50a230c97,Its nice and easily accessible to news around of the world,5,positive
338,f7d4a4e5-c741-4b80-8daa-63741eeed2f3,the update takes away the maximize phone view area bring back opera navigation button above the default phone on screen buttons making the view screen area small...return the feature to hide opera mini navigation buttons...can't update now to miss on my favorite feature,5,negative
339,cf8c87c0-3f21-4f5d-86f7-a63b39344e22,Fast browsing and quick access and navigation,5,positive
340,26c0af80-67d1-42da-bfdc-bfa12674330d,Blind,5,positive
341,9333dde5-4c26-4bdd-b51b-185bf61f453d,Fast and easily accessible,5,positive
342,f5036d24-0935-4811-9997-f9e8627644db,I enjoy using opera mini because of its speed and easy accessibility.,5,positive
343,c0afe9b5-0da6-4b30-b2b4-9b49e52d80df,Ahead of everyone !! Excellent! Just add gesture video player for YouTube also.,5,positive
344,e616eed0-f536-4fd3-91b1-4ebf65d04006,Lost ability to get to bookmarks with last update.  Not a gesture setting prob.  HTC 10,1,negative
345,a13607c5-dd46-43dc-a099-386f31eafa03,Very fast and accessible,5,positive
346,9c23cf8f-108d-4aaf-bccb-77ced3d98b3c,Great navigation.,5,positive
347,d46a41c5-7404-4946-84ee-4de08ea874e9,Very fast navigation. I recommend!,5,positive
