,reviewId,content,score,sentiment
507,16eb9a0b-cc2a-478e-af74-2851408ff539,Work needs to be done on the animation smoothness and homepage. Secondly torrent page needs to more accessible. Icons from the torrent doesn't seem to work as they work in chrome Mozilla safari etc browsers. Anyway speed cannot be compared. Good speed. Even if you are trying to  access a page from a mobile with slow net connection..the page loads pretty fast..in short liked it,4,negative
508,1916ae01-624f-4f43-9f51-1c8a9839fcf0,Fast n accessible,5,positive
509,67a82bf4-43a4-477f-8059-941d80c3550b,"Hi, I really love this app for its efficiency and easy navigation, however when I updated to the recent version it would freeze and I couldn't type into the search bar before shutting itself off. Please help. Thank you.",2,negative
510,472b07d7-a82c-41ee-8f81-3beb6d7eb5de,Good reliable easy accessible in cheap medium.,4,positive
511,f9361845-01db-4759-ac05-110520becc95,"Love the browser! But i would really like a theme, like a solid red colour for the phone layout on the top navigation bar, that would be great.",5,positive
512,9595c02d-33ff-4554-8968-1733b48d66cd,I love the ease of navigation,5,positive
513,f60d371b-b972-4295-8c71-11722f65c014,Its makes everything i search for accessible,5,negative
514,8af8b25f-4564-4aae-b8cc-c3de83515ef8,great work nice navigation.,4,positive
515,bb7cf837-7113-4e75-897d-93f111780f14,"This is wow,it is faster and easly accessible",5,positive
516,10949a8f-d5b0-4d3c-ae4f-fa3bbea4bb13,Very much simple to use. But creates problems while downloading subtitles.,4,positive
517,34ad64a6-1ddd-438d-8040-42dbc54e32b5,"Which browser is the best? ans. 1. which has text to speech button to read web page directly for blind. 2. which has web to pdf 3. which has built in flash player to listen any news portal such as ""BBC"" ""CNN"". accordance with this problem opera is the most bad browser.",1,negative
518,936d1fb4-3ccd-44f7-9c92-756e4588578b,Very accessible,5,positive
519,ba97ba12-6695-446a-82c9-feeea38ebda7,It's awesome in respect to easy navigation.,5,positive
520,5b74226d-0195-467f-8240-6ed89f4e16f2,huh..no caption ✌✌✌,5,positive
521,da99443d-757a-40f0-a833-47c2ad0496d5,"Unfortunately, there is no way to access any settings.  You can't set mode, can't set start page, can't set accessibility.    Wayno",1,negative
522,97dc72bf-4a30-406f-9ced-d61cebc3ef3c,"Light on its feet, punchy, extremely functional and with lots of easily accessible options. Opera Mini provides an experience that's as close to ideal as you're likely to find, without all the bloat by which the other mainstream android browsers are beleaguered.",5,positive
523,afc85e58-f9be-43b1-bb64-2a980b707627,Easily accessible,5,negative
524,5d192d77-588a-4eac-b817-3dbccd378756,Using twitter on extreme mode is horrific. It becomes unrecognisable. Maintain the essential look for the navigation menu.,3,negative
525,c0f64ef5-e636-408f-a1da-f80fc85c3775,"Opera was my choice, it is and it will be. Love the eye strain feature. Very Easy navigation and user comfortable options.",5,positive
526,4feea935-fb3d-480d-ba29-8ce78f2f50d5,Quick navigation system & download,5,negative
527,ac434e2e-fe1e-4cd8-9755-994cfcbf6cea,"It's cool, light, faster and low cost for navigation on web. Its my favorite browser,  the best!!!",5,positive
528,90fbb5a5-0bed-45ba-90ac-932a23a152a2,Accessible... Reliable... Fast...yeah I just like it!,4,positive
529,31a4210e-f01c-464c-afee-6ebfdd786863,"About the best browser out there across most platforms I dare say. Provides smooth and fast navigation through the internet with minimal demand on my phones processing power and as a result, a longer battery life... Kudos",5,positive
530,1d3842a4-a5dd-478a-9fdf-9761deef4076,"The app is is great. It's interface is superb. The navigation between tabs is excellent. Overall, surely one of the best!",5,positive
531,dc89f59c-0938-4625-8664-ab4c9cdc6ab4,"It has very smooth navigation with user friendly interface,also very fast in browsing with the benefit of low consumption of data.",5,positive
532,f109e3d1-1168-4631-bedd-e20714c0f472,Simply & Easily Accessible,5,positive
533,d1f9d4c4-0fdd-40ca-9e16-3c416cc754f0,"The Opera browser works fine and has some really cool features. Unfortunately the features, I didn't think, were all that helpful if data costs are not a concern. If you are concerned I can see this being the browser of choice. The only real negative I found during my stint using Opera, was that the address bar kept popping in when I scrolled to the top of the page. This was particularly a neusiance because most websites have navigation at the top of the page, and Opera puts it under the address bar.",3,negative
534,29e80449-574f-4fef-b622-204e222a6b42,"The latest version supports 13 Indian languages,but oriya is not accessible though it was mentioned on your page.",4,negative
535,262ae760-a29e-4985-b9cf-3558205d3e85,This app is not so good as that of other mini browser because it does not opens pages at all which are easily accessible in other browsers,1,negative
536,f584dcf3-de31-45fe-b5f3-94862b205a92,"I've linked my Facebook account and turned on the notifications and it works great, it's just that there isn't any option to disable the vibration. Just a minor issue but hoping you could fix that in the next update.",4,positive
537,eb37813e-3504-4146-9e98-064414bb6ad7,The best app to have all your stuff in one place and save on data network with ease navigation.,5,positive
538,f4373ca6-8673-44fe-8162-33d4fbec7675,Tint the status bar bro. And the navigation panel if you can manage (how hard could it be pfft).,5,positive
539,33aecca1-68f9-4159-95e6-0218fb261166,How to stop vibration in fb push notifications?,4,negative
540,1d388fc3-92ff-4fe1-b5d2-40b0bbc8d9d1,The navigation is a big let down - when you are on a web page and you want to navigate to a bookmark in a folder you now need to swipe down tap the start screen icon tap bookmarks tap folder tap bookmark to get the bookmark you wanted -- 4 steps! -- I used the old version 3.something until I got new phone but after downloading this version I tried to find the old one without success so I'm looking for something better till this issue is sorted,1,negative
541,b6fec621-d668-4e65-8c06-738131e90276,Position of refreshing and cancellation symbols should be in bottom line for easy navigation. Now it is very difficult to use. Change it.,4,positive
542,f66ef2e6-2f7d-41b2-b92b-8bbf030fe890,Apps appears better with several options of navigation.,5,negative
543,e4250548-7474-4f2c-96c5-ca11bb70489c,I've used it for 3 months now and loved it. It is easy to use and accessible,5,positive
544,a0b128f2-6011-4c03-8789-cfb5b211198f,"Im fred up of opening bigger sites, but it doesnt even opening google search results working properly. Web designs are responsive but not accessible",1,negative
545,6f9d6b6b-d095-442f-bccd-90a9151f41fe,Very nice navigation. Less memory consume.,5,negative
546,2e31ab85-9d37-4735-b383-3e17749cc3b0,No save page for offline feature... It was in the old versions... Edit: found it. Sorry for being so lame... But you could have made the option more accessible and visible though.,4,negative
547,48571178-e1d0-4685-976f-fbb6efef51b8,"I think the developer worked on our reviews and now this browser contains all the features that every browser should have. IT  NOW ALSO SUPPORTS LIVE VIDEO STREAMING. But that's not the end, this one's got some awesome additional  features too which others don't have. It has a very beautiful interface, ultra data saving mode, fast loading, web page saver, direct exit button, different layouts(tablet, phone & classic), speed dia, easy navigation, small app size and much more. Must try it.",5,negative
548,35ac8022-b5dd-49d6-b8d2-fab234ee530e,"This browser is the number 1 in helping you save bandwidth. It keeps navigation simple and clean. However, I miss the central and most important feature every browser must have: the Addblock plus extension. Without it, navigation is often unbearable. That is why Firefox for Android rocks.",3,positive
549,31ab0ee7-8cc3-411c-a58a-ede5bf1680c0,"its great  i love it , bt refresh option is in wrong place , it must be at bottom near navigation . the downloading stops while using other apps. need to go to the app again to restart. The outlook Twitter page is very bad, i dnt know it went on which mode",5,negative
550,2936033c-55a1-42aa-869b-7d374e46621a,Very accessible,4,positive
551,7affbd8c-1e1f-4c8c-8ebb-67811b3a372b,"The older Opera mini bottom navigation was excellent for either-hand use. With the Opera button and reload/stop all the way on the right, left-handed use is awkward.  Which means snapping into two-handed, which is a nuisance.  I'd give up a row of screen if i could have things more useable.",4,negative
552,f6aad3b5-28fe-4db1-a8ee-12cce31f57d5,"Pages reload when I tap on the app without internet connection. Also, when I press the back button, the previous page reloads (unlike before). The pages reloading are time consuming and annoying. Lastly when I tap on a suggestion, the ULR box displays ""Google"" and nothing on the supposed new page. This forces me to reload (again, time consuming) the page until I get the result. I liked the new layout and navigation. It is easy to use and easy to handle. :)",2,negative
553,62fd1328-5a9c-49b6-bb6f-80bbabaa93da,The new high savings mode is highly useful. It makes the entire internet more accessible while consuming a lot lesser memory and bandwith especially on devices such as my Optimus One. Thumbs UP. Only downside is it's kind of slow even with 3G enabled. Keep innovating.,5,positive
554,283d5b75-6a68-4eb5-8739-2d5ca3e4437b,It's a nice update. But it gives no help to block ads or switch to a different user agent for easy accessibility. So I can only give it a 3. Too many spam websites all over the Internet for a Web browser not to have an ad block support,3,negative
555,c50e09cc-9e53-4096-8d20-5c18391876bd,"Just updated the latest version and started using the classic mode . Quickly i found out that the status bar is not responding smoothly . Whenever i try to load a few tabs at once , there is no status/navigation bar on the bottom ....so could not use the arrow button or switch the tabs (as navigation buttons seemed unavailable most of the times). Rated 3 stars now . Please fix the issue with navigation/status bar so that it remains always visible and i can switch to the tabs always whenever i needed.",3,negative
556,cca2ad86-7933-4b26-9aef-1f758b841a54,"Easier to use, doesn't stop randomly very easily accessible etc",5,positive
557,080bea56-2e45-452c-8e69-7832b43d4188,"I don't know what happen, the first month I use opera it's always work. But another month I use it,whenever I used it I can't open any tab and then the image of opera with caption ""SERVER ERROR"" it's pop out,the internet connection was good,I'd try to use other web and it's work,even I'd cleared the data properly,nothing's change.",1,negative
558,e0685ed2-1724-4867-9f90-a4fe25db9ef0,Option to hide system navigation bar would be nice,4,negative
559,1edfe20f-394e-4de7-bf14-fda103cd9e73,Faster and pages are better optimized. Navigation is just a little less easy than the previous versions.,4,negative
560,8ee72647-bd19-4fb2-8281-4f01232b640a,No caption.,5,negative
561,49f0276c-083d-4abd-8975-344661dcca93,I like it... It facilitates my navigation on every website,5,positive
562,535d59a2-ed21-4507-aad5-288f0a7ba580,Take less space and accessible to evreything with an awosome browsing speed.. worth download,4,positive
563,707bae06-4c6d-439d-9994-0a3d18d899e6,"I had a problem. How to change fonts in a smaller size than the ""small"" options in settings. Do I look like blind to make it bigger than my fingers? Please fix this. your browser is so great that i cant live without it. buy that fonts thinggy ruined everyrthing. pls make an options like selectin a font size. thank you. you will get your 2 stars when you fix this. in a first place you deserve 5. really i just hate the font sizes.",3,negative
564,24d82b9e-2c54-48fc-be33-5fc15da491fb,"I have been using and loving opera mini since its low end java version.  I'm using its 7.6.4 version instead of New Opera Mini now. Because it has very cool smooth menu layout and too easier navigation bar and its icons, which are not found in New. And the best feature of old version is service of adding search engine from desired websites to opera mini search field. Also this service is missing in New. However, I'm very happy with opera mini. It is the best selection for HTML browsing. Keep it up.",3,negative
565,3b8c61ed-fcbe-41c8-9bb4-250039f03284,India start of web page. Load slower than chrome . compression is less . some times not accessible though I have good connection. Fix it not working tried many times,2,negative
566,f80bdf97-4286-4b25-86a6-0a9d4324cd05,This latest version makes navigation pretty sweet,4,positive
567,3c0c6811-a973-495e-a9dd-038f7344f45c,"Opera mini was always best mobile internet browser. But this new version looks incompatible and non supportive for some websites including banking websites. Please take note that those websites were easily accessible earlier with older versions. Hope Opera will improve and will become best again.For example current world hockey league official website is not completely visible,  but has no problem on other mobile browser.The answer for your query is site is not seen completely. Few portion is not displayed.",2,negative
568,0ce72f96-a8c8-4d3b-bc58-aa335252c405,This is good for my mobile. Very light and accessible.,5,positive
569,7f042572-41ed-47b1-b914-788ef55b7983,Its good compared to its previous version.. But it can be proved a lot by adding more shortcuts for navigation... And also download speed is too poor....,3,negative
570,fba0115c-3d1c-487a-b93a-3f568c760576,Great and very nice seller. Thanks for his honesty and caring for good will for the customer. I will never forget for the wonderful gesture. Thank you again. Ramachandran,5,positive
571,c8ae2e11-f5c3-4ce6-af42-ee2d7718fa00,Excellent but requests voice navigation.,5,positive
572,af0a652e-4be2-4f1d-ab16-d1f3e5e56b5d,Please add swipe gesture to go next & previous page......,4,positive
573,b9e8ec7a-6599-4e5d-a2ce-be4a3dbc09df,"I am a blind supporter of opera. But now it annoyed me. Cause it doesn't support ridmik keyboard. When you want to type Bengali using ridmik, it types English instead of Bengali. Please recover this error ASAP",2,positive
574,a871ca47-1664-4fbf-95ca-6f9a9bfff2ea,It's very effective to save consumption of large amount of data. Night mode enabling is not placed in an easy accessible place. Think will fix shortly..,4,negative
575,ed6f5aed-5c13-4817-8010-60e979497691,This is great. Been using this for the past years and it is still the best lightweight browser out there. I wish there are gesture support for switching tabs,4,positive
576,9c9cceb5-39be-4795-85dc-dedf2bddebc6,Websites  like Facebook  are not perfectly  accessible,4,positive
577,3eca1790-0524-45ad-a219-26eb3ec365a0,"The new UI is best. And again opera has done a great job in making things simple and easy,  in which they r best. The new night mode is also remarkable. Bt on the other side of the coin, downloading is too slow as compared to there competitors UC and Chrome. And the android based web pages are not so accessible.  So opera plz work on the bugs hope next time i can give u full stars. And at last no bookmarks  option (seriously)",2,positive
578,a1fb050e-2170-4375-8d99-49ef156b1414,"Scrolling in history page is slow and laggy when the history is fully loaded. Unresponsive when typed in addres bar. The connection sometimes doesn't respond, you have to click the link twice to make sure page load. Lastly, 'start page' button (classic layout) on navigation pane is annoying, please revert it back to 'refresh/stop'. Thanks in advance anyway.",2,negative
579,da93f0f6-3146-4cfc-a1c0-ef5668a2b0c9,"It seems to be able to save us some data. The navigation speed appears to be lower...but the main issues are error msg, when opening pages.... To often lately....",3,negative
580,32864c2b-f2b6-4ea2-bcc1-b001a470aa89,"De app consumes little data and really like it. But pls help fix in zoom control button for easy navigation. Also u can't play video online, it only shows download option with de downloading even slower and can't resumed after paused. Fix for de two other stars. Tanx.",3,negative
581,1b27d0df-7ff1-4ed5-a847-de864f201c9c,"The latest update of Opera Mini is fast, more personalized, easy to navigate, and I found it fun browsing in contrast to its previous versions. Thumbs up for the team! (Y)",5,positive
582,9188b432-ff52-4016-a3d5-786721da0b74,"The new interface may look great, but several functions which were easily accessible before have now become somewhat cumbersome. The fact that you have to open the start page every time you want to access bookmarks or saved pages is a deal breaker for me. No thanks. I'll stick with the ""classic"" opera mini for the time being.",2,negative
583,9b2d9a64-bc05-417d-a601-4e6226e1bf0a,"I like the new opera mini, i think the new change tab is handy if you open multiple tab. but, if you only open two tab  it become a pain to just switch between those two, can you somehow add a quick gesture to switch tab faster? Thanks",4,negative
584,50b0942f-8dd7-4424-af54-70574840e8b0,Its fast and accessible,5,positive
585,5c499a40-aa54-47d9-bb48-232638761b95,Bookmarks not working. Navigation on this version is very hectic.,1,negative
586,acba5ea7-b53a-4f9b-bf40-dda92d6955ee,More easy and accessible than the old version...I love it,5,positive
587,fffbb912-ac66-45b2-a0ae-08cedded297b,Really appreciating update from opera. I'm impressed. Please carry on. It needs to support more web-pages. I am unable to get navigation bar in portrait mod on my XOLO Q2500 Android 4.2.,5,negative
588,f3cb327e-4703-42db-a02b-93b8b9f4b0a8,New opera nini has very smart interface & super accessibility,5,positive
589,4bdc1905-f88e-4339-a2be-c3c1cf186b4e,Very fast and easy navigation,4,positive
590,270c79e0-1664-49ee-9e46-7ca1828c23ae,I have trouble with this app sometimes when i have search anything he says this site was no accessible please solve this problem,3,negative
591,73fafec7-1cb3-4289-80d5-c803de0cf417,"Old one was much better. This one looks better, certainly, but, functionally, the old one had a much more ergonomic layout, specifically, the navigation bar.",1,positive
592,046aa73b-41d4-42d5-91cd-e8580108bedf,It is awesomely fast. Well developed. But the prblm is there is no navigation keys and refresh key,4,negative
593,592b7f0b-9f97-48df-95b2-210a3e7d1c6d,i love the simplicity and easy navigation :) thanks opera! ;),5,positive
594,31725b40-4807-45da-b836-2a8f74df8aba,"The best feature of the new update is the reload gesture only! It has a lot of bugs: Stuck while scrolling, sudden stop etc etc...this is the mini version for lower end phones, but you made it heavy! So, 2 star for the reload feature only...",2,positive
595,8cb06386-899f-4366-b7fd-c984cae359d1,"The previous Opera app had the X to stop pages loading on the bottom menu. Nice easily accessible place, the very reason I loved Opera over other browsers. Very easy to jab at when you've accidentally clicked on a wrong link (easy to do with so many ads popping up on webpages nowadays). Now its moved up to the top, not as easy for me to quickly reach with my thumb on larger screen phones. Opera has lost its USP over other browers. The one thing that was different is gone. Shame!",2,negative
596,6f03fa34-bd7c-4617-b0e6-37d20c68385a,"Great app, easy and secured browsing and effortless navigation throughout.... Loved it",5,positive
597,8b7cda05-ff60-4b5c-aa86-04b85e663a01,Becos no  navigation to save information gotten .mtcheew,1,negative
598,3b9ac6b0-6ce7-4607-a002-f4a7236646de,Accessibility is not maximized,3,negative
599,12d202cb-d5a9-4ea2-b05c-cf30c1361724,Incognito to normal tab switch is really help for some time. But i want to hide android navigation keys like immersive mode for fullest screen reading.,5,negative
600,5f557a38-f9b9-4a84-8a6f-d546a68c171d,"sometimes it faster than old opera mini, but sometimes slower than old opera mini.still often crash. better ui, especially in speed dial and tab chooser, but there is no bookmark or saved pages in navigation bar. must go back to start page to open bookmark or saved pages. it must delete saved pages one by one, can't rename saved pages directly (must go back to start pages to rename it), saved pages view in icon (which i prefer in list, like bookmark)",2,negative
601,f7fe0244-43a0-4365-972f-78586a08353b,Awesome stuff.  I liked the navigation between tabs and you just did a great job fellas!,5,positive
602,9ab4df8c-f91f-4466-bfa0-2b2615a0d515,"Not able to login...I am from India...And in fullscreen mode, the on screen navigation buttons doesn't hide...Plz fix this!",4,negative
603,9896ba18-091e-476a-9095-a7d22f86fde5,"Pages load faster, ui is sleek, however its frustrating when the navigation pane comes up while you are navigating upwards; still better then before",5,negative
604,2ca2a089-62ab-4c65-bb19-e6a310d7ab68,Please make an option to hide navigation bar,4,negative
605,13e7bdec-13e5-4fb5-8d17-aba406f8a1aa,"I love the app, works well as if its not a beta version but there is only one major thing that is bugging me when am using it, refresh button is too far. Its OK when you are using this app on a 4inch screen but it becomes a problem when you are on 5inch screen phone or above, could you put the refresh button down on the bottom navigation key? and please add option of hiding navigation bar. Good work Opera",4,negative
