,reviewId,content,score,sentiment
0,676e18c8-90de-4034-a892-c16aab8b1b4f,"I love this app Even without data, it's accessible.",4,positive
1,facabd46-0d3f-45c5-ae22-29b926e1ce76,Very easy to navigate and accessible,5,positive
2,5591c7f1-e515-4774-af2d-371bb303e297,I want to appreciate your kind gesture keep up the good work,5,positive
3,48eca65e-3cac-4088-ba5d-b4d1f77be0b3,This app makes information easy accessible and also news around localandinternational,5,positive
4,1e0faf1a-5a0a-45b0-b8e8-17d5575ff8b0,It's very easy and simple and accessible,1,positive
5,2bf91ebc-dc10-4385-8654-80bebbfdc410,M RASHID DEAF Khan,1,positive
6,f4359e72-33a2-43fa-b846-9fd83115739f,"simply the best, user-friendly,straight foward navigation tool.",5,positive
7,7ba7fd66-db9f-47e6-8ed0-a968376a303f,Opera mini made internet easily accessible and fast,5,positive
8,d0e4473b-ad56-4481-8bd3-69f587334821,Accessible,4,negative
9,258fb9d2-dbcd-4a53-ab6f-3348aa5647a2,"Indeed its an excellent app. in term of internet accessibility, ads blocker and many more....",5,positive
10,01cb31e8-ea14-4b33-a78b-8b0387f2004c,Awesome. Very fast and accessible!👍,5,positive
11,18d42d6f-28fa-422d-9d23-a4e0626186df,Convenient & accessible,5,positive
12,6b7bdd57-74a0-4bf4-b2e7-483d94689420,"Please bring back the last video player from version 50, the current player isn't any better than the old one, it's laggy and doesn't have any gesture control for fast forward and rewind. Also, please remove the downloading icon animation, it's only make the webpage unresponsive and takes a couple seconds to disappear. Now it's getting worse with fullscreen ads, i can understand ad banners, but fullscreen ads? That's terrible",1,negative
13,a9582ff6-9050-4b78-831f-50e2e8ec2e6a,"Worst update! Everytime i open it, it freezes up and won't let me do anything. You keep updating it and still the same lag and some sites are not accessible! Been using this app for 7 years! Because of this, I'm uninstalling it.",1,negative
14,d630d98e-dcdd-4136-8943-3e70581ccc39,"Good for saving data and great for downloading videos. But No force enable zoom accessibility feature. Good ad blocker, however inserts its own ads sometimes.",4,positive
15,919e5a56-f18e-4cf1-8789-d2f7ac851d35,Please this app is banded and this 2 bed is accessible,1,positive
16,2ff0f436-ae2e-4bee-bdbf-332c182a48f2,Through making trade accessible and easy to everyone INGOT Brokers offers wide set of education material,5,negative
17,6c811ed7-f172-451d-8bfb-47dfa0adf773,Please what happened to Tubidy... It's no longer accessible,2,negative
18,d74e289b-1f9a-4c96-a286-5d178bede37b,"I love it, but it kinda prevents me from using navigation gestures because the toolbar is at the bottom. And on my samsung note, I can't redirect links to opera. But I think that's just samsung's fault.",5,positive
19,571e289d-fe98-4003-b82f-8447af44d294,Easy accessibility,5,positive
20,61345de7-9d0d-4594-b540-3e2c3216bffb,Chinese movies I downloaded with this opera mini never came with subtitles I hate this app,1,negative
21,3388c335-941e-4e1d-b77c-58e22aafa047,I love the current speed of accessibility.,5,positive
22,960dbfa8-f485-4601-8da7-49c11ebcbe3d,It's just simply accessible.,5,positive
23,08573060-2332-40a8-a8cf-2bef5d3584ac,It really disappointing that your download list is easily accessible with just swipe which often make it easy to delete file without asking question,2,positive
24,e23800a0-6e0d-4fe3-9cc0-6aa61d6d63ff,"Easly accessible, and user friendly.",4,positive
25,207e3f2e-408e-4cd4-b967-d6996ffc4122,Faster easier navigation tools. Huge storage space and room for improvement,5,negative
26,0e81fd39-038d-4b55-9e25-cd0ee1a2a004,"This app is super fast and pleasurable. It gives a feel that excites a true internet guru. Another unique thing about this app is that it gives you FREE 1.5gb monthly to navigate through the internet. What an appreciable gesture! But ads control is not very effective, else you deserve a five star all the way!",4,positive
27,f281e234-9946-45aa-8be1-d349c271c90f,"five for it is the best.Free data included, easily download mp4/3...PDF download easily accessible to social media for free",5,positive
28,ebc9df4b-84a8-467e-aa1d-a7b28ef2ed64,The app is absolutely fine in navigation,5,positive
29,4bf89dfe-da6b-4594-bf96-cecab45461c9,Easy and accessible,5,positive
30,e337cf94-6566-415e-9954-fc845920f1db,Exciting. Easily accessible. Has Exciting qoutations relevant to all situations,5,positive
31,dc18bc3e-0951-4a64-a5d8-9e096ffbd180,Faster reliable and easy accessibility,5,positive
32,b6822921-b649-4d68-b1c5-844a6f3a4dba,Just dope...accessible,4,positive
33,509da6ef-3478-41d2-bb2a-0395d9df9ed2,Easily accessible and reliable to use. Nice app and fastest in space.,5,positive
34,bd6f26af-11b8-4769-a0df-8cdcc5f370ca,Very Easy and Accessible.,5,positive
35,854e9158-ecf2-4c7b-9013-c72fccc89a2b,Convenient and easy accessible,5,positive
36,c4359319-caea-45cc-b906-dbafd2a8db3e,Emran deaf,2,positive
37,1c0bf2a9-2356-4d76-b145-db99e34f2c29,Amazingly great and easily accessible,5,positive
38,f2c1b3ce-afa5-4c80-9dda-bf245a07b105,Very accessible,4,positive
39,2c51aa97-092d-4b60-95e1-9cd41bcf95d5,This is the best app. Easy to be used and more accessible.,5,positive
40,383932bd-8567-4017-847c-1b26c21ca291,Its easy to use and accessible,5,positive
41,50b0caca-e579-4e62-87b4-6f506ad24b84,I am very interesting with this app bcoz of its accessibility to all updates.,5,positive
42,758e377c-eb7e-4309-8124-ecf9f7e510b0,Easy and accessible.,5,positive
43,b133e501-9327-4bb8-9167-543b8fd17667,Fast and easy accessible,5,positive
44,0d085078-ea85-4eaf-a95b-643910cb2277,please allow to save offline pages to accessible memory. I want to be able to transfer the files,5,negative
45,2e6f72c3-dbd6-4cf2-aeb3-1ab48c8e52ed,I love this app it does it all and very well I can't think of any ting more it needs the download speed is fast options are numerous navigation is exhalent the best I've ever used. Try it.,5,positive
46,501a6b0b-4031-4120-97cd-c85b995d1d2c,"This app is magnificent, in fact thanks to the app designers making all things easy, fast and accessible.",5,positive
47,c9f8babb-7d6d-4474-ad18-37146259eb11,No caption facebook just solowly.working,3,negative
48,b8191366-cf90-4d43-a452-25e17acd7c7e,"This app is very fast,unique and accessible.",1,positive
49,b9cba5e0-cda3-4c65-b14e-5eeb5d91a4d5,Good and accessible,4,positive
50,cf3775ea-d9d4-4baa-aaf7-488eae38e245,"OPERA, IS A GOOD INTERNET MOBILITY",5,positive
51,65f1e096-3d20-438a-843f-4b9b0aff61be,"If you are visually impaired person then this app is not for you , this app is unaccessible and requesting to developer to make this app accessible even for blind also",1,negative
52,1c876dc0-6182-4077-a2b0-05b65df96459,Too amazing with easy accessibility of windows,5,positive
53,15624864-90ae-493b-bcce-318bcd05c6e5,No caption,5,negative
54,4b90d5df-e46d-497e-b5ce-f5c323503658,Deaf,5,positive
55,edb0a3cb-9e39-4637-a40e-a72c61ece76d,"This app has smooth navigation, keep it up thanks",5,positive
56,e950f2dd-1648-4b7f-a6f2-ee4939643de7,Hi good tonight me deaf want game 🎮,5,positive
57,a54cd6a2-756f-4e85-abb1-b32d57d2fe19,"Good app, but please provide offline pages to an accessible location. And make option to save offline news individually, so favorite news do not be removed when refreshed.",3,negative
58,99bc0241-7a01-41d2-b6ba-433657de9e5d,"Thank you for a wonderful app Very accessible,easy to use . thanks",5,positive
59,b7dcfa9b-d405-4811-968a-fad0ac9f35f9,Excellent and smooth accessibility,1,positive
60,93b6d684-aa8f-45e1-8bb3-c4eade79a69e,The ads disability is very bad...,1,negative
61,fedd1de5-6dc8-48e9-bb92-87b407dea123,Always very easy and accessible I really like the app,5,positive
62,e3801bc2-89e0-448f-a348-169f1fd7c768,"Good,but only to android phone users.improve it so it can be easily accessible by all,",4,positive
63,1d7f72f6-3fbe-45c3-9eb2-f52c48b587c0,"My suggestion, keep the download speed meter on top while scrolling down download list. And remove the delete download file gesture an put the delete option in the three dots menu, because i sometime accidentaly delete the file when i tap the file (when i want to pause or continue) due to the slow response (not everybody who have good phone, fast internet and lucky luke/spiderman response). although there is undo button, it's sometime to late.",5,positive
64,1a6c8875-ff3d-4672-9c51-bb077aae1c4c,Lovely app and easily accessible,5,positive
65,d8e52d03-ba29-4438-825c-43c0531b5e00,Accessible always 😊,5,negative
66,eb9a1c24-5cf3-4793-81ac-7ad160ff0503,Very reliable easy accessible and good latest new features,5,positive
67,ed99c13e-6c5a-4c1d-b2eb-eb7ec507e30d,Blind app,5,positive
68,12aa9dd6-2c13-4ab6-9de6-67ba73ef3493,It's one of the best browsers but improve your downloading mobility and block the external links when downloading.,5,positive
69,f33a43b3-872a-417e-a7f5-8939490ab1f6,"This app is cool ,accessible and easy to use",4,positive
70,b3ad6229-2728-4cf9-a5cb-b94059ecaa50,Kudos to opera mini for this kind of gesture,1,positive
71,4f9293b3-7ff6-473d-859c-5b4f244eb511,active subtitles please,5,positive
72,8bd35ed1-c768-44d3-a61c-e053b2eda587,"Just too good if i should describe,the high accessibility,the video quality,the confortable interactive qualities...its simply the best.",5,positive
73,64b6acdd-7dd1-46e1-9021-d5f641d75939,Good. Love the add blocking feature. Quite accessible with screen reader Talkback as well.,5,positive
74,5d1cbf22-66e9-4fc7-9da3-5946245fb3ca,Accessible,3,negative
75,8607fee9-c489-46c0-aa8d-00df4db8dca9,Awesome experience but not accessible,4,positive
76,250add6b-c1e0-4e78-8e1c-02a0f609fbd0,Quick and accessible big up,5,positive
77,32f47551-9eda-467f-adc5-4ffcd1fc72b5,My only problem is obviously those very persistent adverts. Otherwise the app is easily accessible and fun to use,4,positive
78,d20528af-90e5-4b20-b8b9-904b28377ec8,"My favorite feature is syncing bookmarks and speed dial. It's working well. but there are some weird problems while browsing content like ad block became useless, some sites are not accessible. 🙁",3,negative
79,130f5b3e-da5f-4601-9374-056fd99e7eae,I gave full stars because of its fullscreen mode(hiding status and navigation bars) which many other browsers fail to do so.,5,negative
80,e5cfbc47-973b-4988-9845-f82ff45f9463,"rendering of the sites is now terrible some sites is no longer accessible, with this latest update 😑",1,negative
81,d5ef4d36-a929-4897-b0a3-afbba11ad222,Accessible.,5,negative
82,45ea5530-a586-46a7-b15b-b45d8e444534,Thanks for the good gesture.,5,positive
83,f83b969c-1921-4b2b-9758-96e78e8d430d,It's nice and everything is easily accessible.,5,positive
84,0ffddd1e-93e4-48c0-9d92-9c432c93e3da,"Facebook works no more properly after new update. Displays only gibberish. The same is true not only for many web forums, but also for normal websites: no more graphic interface, texts often overlayed, many contents not or only with great impediment accessible. Hotmail is no longer accessible at all. The browser has thus become useless for all practical purposes.",1,negative
85,154f047b-c773-42dc-88ef-10f44ded5651,Really Smooth Interface with clean buttons and functions for navigation! This browser is the best lite browser!,5,positive
86,fa4742cf-440f-4a99-981b-8fcc22cfcd97,Quickly and easily accessible,5,positive
87,1faa5d2d-bcea-4054-b2f0-ead676cdaf3f,"This new update is a disaster and I'm not sorry to 've said it. Older versions are far more better than this junk. Opera use to be one of the best If not the best really missed the Older versions. It's a pity and a disgrace to everything Opera mini stands for cos what's the essence of having an app that's useless in so many aspects? Downloading, navigation, speed and efficiency everything about update app is zero. I am really sorry in advance for any dude that would download this catastrophe!..",1,negative
88,191cacbf-554d-4b49-b5be-7446752c8049,After updating even if I have activated ads disability it's still showing. So frustrating this.,3,negative
89,0bc2acbe-a7ff-47af-ab60-7f92f476c48f,"I miss the old opera mini. It took a single gesture to open a new tab, it successfully blocked ads etc. The new 'updated' version takes many gestures to open new tabs, ads are everywhere. Until your fix your problems, im taking my business elsewhere",1,negative
90,db566802-b402-4901-b590-1338fdf945c4,"I dislike the update to the video player. The gesture is a better option over the forward/backward keys added. Everyone function is perfect, except that unnecessary upgrade.",3,negative
91,812b4450-1e1f-4fb8-93b0-da3ec8c3e036,Support for Google Text-to-Speech app & Talkvack app for the blind like me. Thank you very much!,4,positive
92,1419b115-d5bf-4bef-8ffb-4cd5d6da011d,Good gesture,3,positive
93,4795f11e-888d-4e73-9433-7dc05255f731,Accessible,5,negative
94,b0a49465-51c9-4a35-ad0e-2f2ff796f30b,needs no update though add casino quick accessibility,4,positive
95,a87f0aae-7285-4537-a86a-fbdccdaf1810,"Mindent zarol a Banking algorithms for automatic trading on the exchange in the open access of the network🔥 Now everyone can monetize their time by trading with a trading robot‼️ ️ We have processed and structured these algorithms by levels, made them convenient and accessible for traders who want to move, not sit still! Trading robots are able to independently assess the market situation and make decisions about exiting and entering a position using a built-in algorithm. belepni masol",4,positive
96,5adade08-6a8d-4d08-bad7-e8d43367463b,Just love it's navigation speed,5,positive
97,8ab92936-53ba-4f3e-ab93-eae7a7aaca03,Wow! I love this app... Its very very fast and informations are easily accessible,5,positive
98,0a10a1b5-c030-456c-8b80-6df6db6c01a7,Good Accessibility and contemporary news at my comfort,5,positive
99,5adbbaab-0555-4cff-ba39-881ea433053e,It's accessible and quick,4,positive
100,aa650bba-815c-41fd-8479-28504ba42cc8,Good app easily accessible with or without data thumbs up,4,positive
101,f234cc8b-1d6b-4471-b66c-d89b348fc450,Very comfortable and accessible,4,positive
102,f13ffa93-c3c0-4b3b-8aa8-1ddd0ce3626d,increase the timeout for long press to copt text in extreme mode. the navigation become drastic with the low timeout,1,negative
103,56a33ce6-fd63-47d6-97ac-2c1e9f746e1a,Closed caption 4 youtube pls ty,3,positive
104,c27b5389-fe92-4c2f-8cb2-bb28caef90d4,Easily accessible,5,negative
105,d998e1e2-9eb6-4938-9ebf-583e6cfe2f1d,I like the download navigation it's very simple,5,positive
106,20164b07-ff7b-4f02-83a5-60e4c983efb0,"So Lovely, fast, easily accessible and also has great features ❤️ ❤️ ❤️ but the only problem I've noticed is that it can't download movies from some websites. Hope to see it fixed soon 🙏",4,positive
107,6cccc5f2-d944-41bc-b10d-843c67b854a7,"Its a great app, very accessible to use. Can be used by anybody . Nd is handy.",5,positive
108,7fd31170-f168-428b-89e2-c8ba5ea17db2,Not accessible many times,3,negative
109,c7840740-3d88-4770-a792-c7e90d242734,I'm really excited . It's Fast and easily accessible web browser...,3,positive
110,f7b37b3b-9271-4c7d-af40-265c59102122,"Opera is very easy to use, short precise ande inclusive. So I love it",5,positive
111,7db3aa88-f051-4a7d-8138-6c6d3cf72dfd,Fast and easily accessible,5,positive
112,6acb4b90-d93d-451b-9970-4b7fe10b588e,Lovely and accessible,5,positive
113,4a5cf9d8-044d-45f6-9eb3-d971f6e4e897,Totally inclusive,5,positive
114,1d958da1-8243-4bb2-b0c8-8b632c98d2d2,Not Accessible for so many Websites,1,negative
115,05ca7f43-3a99-4a72-9075-44c22d7a5720,"UI is best, but ad blocker is not good. There is requirment to improve Data Savings mode. It is unstable and effect website page layout. Previous update history only shows UI improvement. That is enough now. Features should be added:- 1.Swip forward-backward gesture 2.Dark mode for website enable disable 3.Java script enable disable 4.Powerfull adblocker and tracking block",5,negative
116,38219b94-c708-40a3-a6a7-49615f729b72,Accessibility easy,5,positive
117,9066c2d5-aff7-443c-9e05-2885a93e93f4,I love it.. Fluent and accessible,5,positive
118,e521d133-56b6-4532-970d-d1ed4cc01e77,"Actually this is excellent UI, but did you see disturbing gesture when you changing tab ? That makes eye sick. And plug in video player too, it was in up position, then go down after fullscreen. When not fullscreen it going up again. After closed, its not directly disappear but it floating for a while. Very annoying. Not smooth as older version. Please fix it, i really love Opera Mini Thank You",1,negative
119,f8e9ea23-9739-4de1-871e-114f311894c7,"great browser!! no ads, provision for theme settings and other useful settings like night mode... highly saves on bundles for those who don't have wifi, easy navigation through several tabs, and generally user-friendly...",5,positive
120,5f6e80a6-c3f0-4633-b0b5-85591ea068c7,"I believe the app makes a lot of things as simple as it possibly can and it does make things very accessible and easier to do, only reason I didn't give a five is because there is always room for improvement no matter how great something is",4,positive
121,6ff198d1-14f8-4436-980e-04d732dee8ed,I love the new outlook theme ...but sometimes it lags some webpages ...make sure to fix and bring contrast theme which can turn any webpage into black mode,3,negative
122,8d0ebc27-6ba3-4d8a-8f6c-b9bb5ed9946a,"The last update marks my divorce with opera, tabbed navigation is gone.. weloved opera coz it was different from Google Chrome, now it looks exactly like Chrome and there is no point, switching to Chrome!",1,negative
123,d256abe9-492d-4029-a8d6-9ba69c90818f,The new update is useless.. Tab navigation is not working,1,negative
124,c52ffc80-8532-4fbd-b2a6-d0c514500778,This app working slow taking time to open tabs and navigation,1,negative
125,36ea55d3-86ed-4466-a4f0-0323ed1d803c,Its very accessible and easy to use..,5,positive
126,a9a16ff9-d940-4ffd-982c-d94158c3f200,Very fast and easily accessible,5,positive
127,97c44785-18f9-4af3-8536-dc5ad92b717f,Amazing browser. But need to enhance the fullscreen mode by hiding the navigation bar too. And some sort of gestures to exit this mode. 💙,5,negative
128,9c71c08d-9e04-4272-a6ea-1ace3de87a7d,No caption,5,negative
129,7c1494c7-9762-4159-b281-54c2f4c6020f,Swift. And fast accessible,5,positive
130,3596b125-9047-4426-9979-112f558a3e12,The app is good and accessible...,4,positive
131,a1baaa1e-2b22-4e62-aaa7-8329fd2869e2,Its fast and accessible,5,positive
132,82ca52c0-92b5-461f-a58e-7f57c7afb8a4,"no option to turn off pull to refresh gesture, I really want this function gone, it's keep make me refreshing pages.",3,negative
133,2a61af9a-31a8-43e1-8c95-44b2e549a74b,"Updated 10-3-2020: Full screen in YouTube is not showing subtitles properly, it appears outside screen area, that most of subtitles is not shown. There was a very good option now gone, it was double click the web page, then hold and drag up or down to zoom out and zoom in without using two fingers, please restore this great option. Old feedback: Another thing is the data saving and sync servers, are blocked in Egypt, please try to slove that issue.",4,negative
134,8d926aa2-2467-43ba-b32f-418c776e387e,"Opera Mini really needs to upgrade, their platform is so poorly coded and bad... It needs to meet up to the standards of Chrome and UC Browser. Whenever I click on the navigation menu bar of a website, the website will have to load again just to have the menu open. The browser is very bad!",1,negative
135,716c307d-5c55-4360-bdfb-5a9407433f9b,Using hindi in opera. Lol. Desperate times call for desperate measures. Now look like a knock off app. Please dont compete with UC browser. Its trash :-p. Compete with bromite or chrome Intrusive NEWS notification with vibration at unexpected times that cannot be turned off. It gives me trauma . Uninstalled.,1,negative
136,d32d6f5e-a531-4ba6-ae3d-5beb9ac9c38e,Accessible,5,negative
137,3585c399-9711-4513-bb8a-0da302328532,Easy accessible,5,positive
138,4cc979f7-14e7-4100-9b36-669640930b2a,Best in terms of accessibility,5,positive
139,5dedffb1-1b14-4026-bd41-90a3e3644d95,Safe and easily accessible,5,positive
140,0076f162-67ca-4803-9d33-7739419422b1,Faster accessibility,1,positive
141,bbef0880-3162-4703-868a-4d0916003c74,More accessibility required pls,4,positive
142,c717275b-e21c-4054-8852-3cfc0f816597,It's easily accessible! To top it up the save for offline feature is outstanding.,5,positive
143,c15742d9-febf-4326-a5cf-e728820a5c27,Very fast and accessible,5,positive
144,4bf56681-2fee-4157-84b5-339f065c871e,Very reliable and accessible,5,positive
145,0cba445f-b119-40b3-beed-fdcf1e7d6099,Easy accessible,4,positive
146,8acf63e7-c5b7-403a-bbe1-3d509ff813da,Easily accessible,4,negative
147,e1cfd5dd-6644-4c93-b734-90bcccac25d7,Fast and easily accessible,4,positive
148,4ef8efcf-6fc9-40fc-b15b-8187245a5193,"Fast and reliable, and gives options for better accessibility",5,positive
149,bcb26522-05b4-4cc5-b80e-59a4aa93c890,"Very fast, easy & accessible web browser....... Especially with 4G.",3,positive
150,72058031-6a2a-4558-ad7b-750a2db9d68f,It is very good and accessible,5,positive
151,9a0af557-ca7b-4e64-a61c-0381fbf9f512,No caption,5,negative
152,102df5e8-6441-4a0c-ac62-4a72c37b259f,A good app with helpful features but needs improvement. The buttons must have text lables with the symbols for easy reading. It would also be nice if you had an option to view the menu as a list or grid and there needs to be accessibility options for the night mode as well.,3,positive
153,9fdf5070-20f1-4169-8900-49aed8a97a51,It's really easy to browse. But sometimes the annoying news caption really irritate use.,4,positive
154,7b0357b2-e802-4745-893c-4fe35adc8369,Eassy accessible and fast... I luv it.,5,positive
155,5d28e61f-8e52-468b-aa26-93eb56e0926d,Comes up with errors frequently and requires reloading pages. It also does not automatically change the view of websites for easy navigation by the user,3,negative
156,f90ae3c3-2f91-4058-b167-4b83fcee08f2,Easy navigation,5,positive
157,6d13c049-8317-4415-ba28-ebec3ab78de0,Simple to use very accessible,5,positive
158,80df3126-b959-47c9-8b6b-8594a69ec558,The app is much simpler and easily accessible compare to other browser... I prefer using it to download than any other app,5,positive
159,54afa74d-9291-4136-b1cb-03d80880e63e,The the old video player with touch gesture control is better than the latest update,1,negative
160,678350df-731c-4569-9fc2-78fdf1a69912,"I had to update my review. You guys should really take a leaf out of Chrome's way of handling offline pages. I keep on having issues whenever I update the app and since the pages aren't accessible in the file manager, I am left with a lot of links I have to reload! Despite the potential your app has, the offline pages system sucks and the operation speed is average. As an Opera desktop fan from way back, I hope you fix those areas and make the mobile app just as awesome. Thanks.",2,negative
161,70ec0f7c-61d9-47d7-9003-4c222d5562f8,"Opera mini has been my favorite search engine for over a decade and a half. It provides the best user experience for me with multiple pages, easy navigation and integration with other phone applications. Best thing is ability to pause and run other applications, then reopen Opera right where you had stopped without restarting page. Kudos 👍",5,positive
162,acb6bcc5-cb58-40ad-a786-bf1d05a9525a,"It's easily accessible, downloads very quickly I am so greatful",5,positive
163,f7e88f6b-9aaf-413e-81b9-328ceb371013,i hate the new video player i prefer the gesture controls on the older version.,3,negative
164,8d27c1cc-4a37-4ddf-a821-f232143e5216,Good browser.easy navigation and handy too,5,positive
165,f0b5a00a-2d6f-4193-8fa3-56322dc49e61,"Going Rushy & comlex day by day, Removal of ""saved or offline pages"" from home inner circle & forced vibration is blunder...please reverse these.",1,positive
166,8e94b400-4f7c-4636-90a3-5ffdf4d3217e,Need to improve on the ad disability & speed .,5,negative
167,6f841652-10b2-4cdf-8a5e-c19dc9dcc6ff,Awesome navigation display need new features BUT crushes often,3,positive
168,8b64ade4-9005-4259-852f-be7864587220,quick browsing and easily accessible,4,positive
169,a2e6f13d-5106-4396-a5fc-8df2861fc887,"One of the best, and easily accessible",5,positive
170,d389419c-d355-4cda-909d-09e6014bbeb4,"Good browser I like it very much especially the facebook plugin, but I can not seem to find where the disable button for vibration notification is to be found, I believe the function is missing...?",3,positive
171,33e1379c-5865-4447-8c23-dc7d791be904,Makes social media so accessible,5,positive
172,5738845a-3cd5-470b-a154-2a310bbf062c,this app is not as good as before with poor download gesture and speed,1,negative
173,b168376f-65bb-465c-bb7a-f8363a0b1a8d,Why my opera navigation keys are in Chinese symbols??,1,negative
174,a5088731-8e8e-4e1b-9a09-fe0833904ad5,so easily and accessible,5,positive
175,d993f029-3ddc-42c4-ae42-e1fc9ac80a44,accessibility,5,positive
176,bc9c7ebb-5acf-4af4-b958-cf61499633d1,I love it becauss it akways saves site where i worked on and it is easily accessible anytime,5,negative
177,f5108fbc-9883-4aba-8d4f-b195a608f629,The app should be enable to all inclusive,1,positive
178,ed506169-f367-4334-a8f8-d00de87beb09,Easy accessible,5,positive
179,8cc9180b-8a15-4365-9613-7a4ab963bc9f,you blind old news and current news together,1,negative
180,6ebd0e97-17b5-47d5-bdb3-11c354d6248e,easy and accessible,5,positive
181,0565c911-8beb-4fba-8766-6e2e92d03b90,very accessible,5,positive
182,b947bf8c-a2ea-4299-906b-f5fca1fc8958,"easy navigation, high data speed and data Savings , this app has all.",5,positive
183,b10a127f-ce22-404f-8d01-04f7a5a2bdd0,Great app but need to work more on the navigation; page doesn't have to reload when going back or forth,4,positive
